label,tweet
sadness,hati kecil ini selalu berkata jujur. dan selalu membuat penyesalan setelah apa yang dilakukan itu salah. selalau mengingat bagai mana cara keluar dari zona yang kelam menuju kebenaran. hidup ituh pilihan ! berlaku baik atau pudar ketulusan.
sadness,"Sudah berumur seperti ini aku masih ditanyakan cita-cita apa, tak jawab Di usia sekarang ini saya sudah mengerti tentang adanya privilege di masyarakat yang banyak tidak saya miliki, bisa memenuhi kebutuhan sehari-hari di masa mendatang sudah cukup"
happy,"Dulu dapet tugas kuliah translate 1-2 halaman waktu seminggu aja udah sambat ga abis2 tiap hari. Sekarang, dihajar translate berhalam halaman dengan deadline less than 12 hours.... Tentu hanya BU lah motivasi dan penyemangatku saat ini hehe"
fear,"Honestly, penumpang2 kapal manapun, selalu nakutin buat aku. Bahkan penumpang kapal yg di dp-ku. Paling takut sama penumpang kapal itu sih, makanya aku ogah main ke tag sana, ehe. Horror."
anger,[USERNAME] kamprettt slain otak kriting otak jungkir balik yg sll koar2 tdk konsisten dgn perjuangan dr thn 2015 capres n cawapresny prabocor gatot n prabocor tgb skrg mn nol besar 2018 koar2 lg ganti plesinden hedeh kamplettt begok napsu aj lo
sadness,"Meskipun cara yang dilakukam dilandasi kasihsayang, tapi saya pribadi tak suka dg cara org tua yang mendidik dgn memukul anak di depan org banyak."
sadness,"Baca thread fangirl mahasiswa anti kupu2 tuh rasanya..... ah sudahlah, w udah bukan mahasiswa lagi :) .. gila emang, melawan diri sendiri itu buat gw susah bgt"
anger,"[USERNAME] [USERNAME] [USERNAME] Gini aja terooss...jawaban kalian template, gw ga butuh jawaban template dan pesanan gw dr tgl 28 Mei, apakah gw cm di suruh tunggu tp ga jelas spt ini?Cm jkt Tng lho..mo bilang apa lagi ini jwabnya? Sabar ya kak ini ujia"
love,pantesan ada notif di FB. hari ini 4 thn yg lalu video ini bikin gw makin yakin jatuh cinta pada pandangan pertama sama doi an awal adekgemas fever melanda
sadness,"[USERNAME] Lepas pukul lima di tepi pelataran senja kau beri kode lewat tatapan mata. Sempat aku mengira itu cinta, ternyata justru lara, setelah engkau berkata: ""minggu depan aku nikah, datang ya"""
anger,"[USERNAME] [USERNAME] Mengakui Jaringan 4G nya LEMAH, ya tolong di perkuat dong, jangan sampai Harga Kuota yg 12 Giga, di Rp. 95.000,- tidak sebanding dengan Kualitas Sinyalnya, perkuat di daerah Sariwates, Kiaracondong, Kota Bandung cc: [USERNAME] [URL]"
sadness,"makin hari gua makin khatam sama sifatnya, tololnya gua adalah ""feeling use, but i still missing u and i can't see the end of this."" gitu lah pkknya sotoi gua orgnya emng ceritanya gua pengen rubah cara pandang dia, lebih peduli sama dia, perhatiin dia. but.."
happy,Apa yang allah berikan adalah yang terbaik untuk kita. . . . Jika apa yang kita minta tidak sesuai dengan yang Allah kasih. . . Jangan bersedih. . Lapangkan dada Ikhlaskan hati. .
sadness,Dapat kabar keluarga madiun gajasdi mudik di bekasi. Tiket yg uda dibeli h- sekian bulan dibatalkan. And me? Gapunyaa tiket mudik madiunnn hehhehee
sadness,"tadi ke raacha karna bm tomyam nya, tbtb mas2nya yg nyiapin meja bilang ""kok mukanya kaya ga asing?! sering kesini ya"" wkwkwk mas nya tau aja :("
happy,"[USERNAME] Sekolah pangan mana kak? Hihi menyenangkan kaaan ikut kelas kayak gituan kak. Healing bgt sih buat aku ((jaaah salfook)). Wggwgwgw hooh kak, bahkan banyak hotel yg nyari tau kak. Buat dresssing salad. Gilingaaaan. Naik kasta bgt itu kemb"
happy,Yeaaaaay i did it. Bangun pagi kulangsung running demi finishing 18k challange from #VirtualRunID #DukungBersama #AsianGames2018 #fitmom #runninggirl #runningmom #runningjourney
disgust,jijik bgt liat cowo bucin tpi di belakang masih godain cewe lain
sadness,gerah perjalanan jauh
happy,Happy anniversary 2nd.. Semoga Allah SWT senantiasa melindungi dan menjaga kita dalam menempuh setiap langkah kehidupan. Dan lekas diberi kepercayaan tuk
anger,"Parah si kalian, mikir kalau cewe sama cowo sahabatan selalu terjebak dalam percintaan. So... Please. Gue menghargai kalian yg bertanya karena kalian peduli sama kita. Tapi jangan berpikiran sesuka kalian tanpa alasan dan fakta yg engga engga dong."
disgust,pengen nonton drama connect tapi geli anjiir lihat haein klo berubah regenerasi tubuhnya kek apaan gitu merinding kek lihat cacing banyak atau serabut akar apa yaa itu jijik lihat darah dan lainnya gak masalah sihh
happy,"Yang maha membolak-balikkan hati, alhamdulillah for everything god. Hatiku tenang karena mengetahui bahwa apa yang ditakdirkan untukku tidak akan pernah melewatkanku. [URL]"
fear,"[USERNAME] Liat lgs sit. Gue smp teriak,mana gue lg dikamar mandi.kalo diinget2 serem bet emg wk. Trs pas gue tidur jg pernah malem2 ada genderuw* di depan kasur gue, tuh gue smp nangis krn dia gamau pergi2."
fear,[USERNAME] Laut juga. Taukan gimana konconya hiu megalodon ternyata masih banyak yang idup dengan visualisasi yang lebih creepy daripada setan jenis apapun. Merinding w liat gambarnya doang:(
disgust,bubur diaduk rasanya geli jijik mau muntah
sadness,Ada temen minta gue rekomen dia buat masuk kantor gue. Ya gimana dia kaga siang kaga malem WA-an mulu. Kalah gue yg fangirl dan emak2. Gimana mau rekomen. Kerjanya kapan orang begini.
love,"Yunjin pas perkenalkan peserta di ig langsung jatuh Cinta pas liat fotonya, cantik bgd suaranya Bagus adem bisa main ukulele"
love,"'Kamu mencintai Istri, bukan berarti kamu tidak cinta pada anak. Begitupun sebaliknya.' 'Karena cinta itu rasa, dan rasa, akan semakin tajam jika sering dilatih. Supaya ia terdidik dan semakin sensitif dengan perubahan meski sedikit.'"
happy,"Rajin hadirkan diri dgn majlis ilmu, supaya kita blh mantapkan lagi diri kita. Ilmu akan jd perisai diri kita. Ilmu dan akhlak kena seiring. . Jgn lupa selalu berdoa yang baik.. utk diri sendiri dan org lain. . Trus istiqamah menuju ke arah kebaikan"
disgust,jijik banget sama si sambo anjing neraka aja kebagusan buat ni orang udah ngebunuh menipu dan bohong lagi
happy,lagu ini kayaknya lagi hits sangat ! memang enak sih ensenang just give me a reason by p!nk (at kara's rom)
anger,selamat jam pulang ngantor! selamat bermacet2 ria! pft
disgust,teume lo ambil ginian buat apa coba sumpah jijik
anger,"ELING GA SIH NIH 3????!!!!!! BIASANYA SECEPAT KILAT, SKRG LAMBAT BGT INSTAGRAM GA KE REFRESH SAMA SEKALI TWITTER JUGA SAMA!!!!!!!!!!! GIMANA NIH? BOSEN NANYAIN NOMOR MULU TAPI UDAH 5 HARI SELAMBAT INI [USERNAME]"
disgust,jijik poll ndelok lanangan kek ngene pdhl ganok seng bahas strata ekonomi pendidikan dsb lol f
love,"Katherine sofia setelah bener"" ngrasa capek bgt sma kerjaan, minimal seminggu sekali harus bgt ngasi reward ke diri sendiri. semacam me time dg memanjakan diri~"
sadness,"Aku rindu Tadi malam sebenarnya. Tapi sinyal menahanku. Jadi aku lanjutkan saja siang ini. [USERNAME] , aku rindu.. :("
happy,"Terus jadi tiba tiba kangen dipanggil nama kecil. Karena udah lama banget ngga denger dipanggil ""dia"" kangen. Wkwk. Terakhir jaman SMA sih ada temen temen yang 'so akrab' panggil gitu. Geli. Tapi sekarang malah kangen."
anger,"Kalau boleh jujur, sampe sekarang gue masih belom sepenuhnya menerima perilaku ga sopan orang ini yg berusaha keluar masuk hubungan kita dulu. Karena gue ngerasa ga adil aja. Gue ga pernah ngerusak hubungan orang. Sampe sekarang kalau gue inget caranya masuk, gue ga habis pikir."
love,"Kehidupan terindah dan membahagiakan di mana Allah membuat kita selalu dalam cinta-Nya dan di mana masih ada orangtua yang kita cintai *Selamat hari anak nasional* Terus berusaha untuk menjadi seorang anak yang dapat membahagiakan orangtua, agama, bangsa dan negara Azure"
happy,"suatu saat nanti, kalo aku noleh ke belakang dan inget masa sekarang aku bakal senyum dan bilang di dalem hati 'aku ga kehilangan apapun, tapi dia yg kehilangan orang yang paling sayang sama dia'."
disgust,dah la mainan lubang tai ya jijik sial mesti masa main terkena taik sekali kanyucks
anger,"Melihat udah terlalu banyak [USERNAME] project yang jatohnya malah jadi scam dan fraud, asli gue pengen coba deh bawa mereka sama creator creator mereka yang udah bawa kabur duit banyak orang (termasuk gue) ke ranah hukum Indonesia."
love,Tahukah kamu bahwa pada saat itu papa merasa gagal membuat anaknya tersenyum? Saat kamu diwisuda sebagai seorang sarjana Papa adalah orang pertama yang berdiri dan memberi tepuk tangan untukmu.
sadness,"lucu sih kenapa ada pasangan yg masih tukeran pass ig . dimana komitmen kalian yg ada embel2 "" kepercayaan"" apa pasangan kalian tukang selingkuh? HAHA ciyaaaaan"
sadness,"biasanya marketing itu yg ngejar2 cust ya? tapi gw kebalik lhooo, gw yg dikejar2 cust muluu,,,sampe kdg2 cari cara, gmn ini caranya nolak"
disgust,gak tau ini gemes tapi jijik banget
sadness,"Kenapa sekarang bisa beda banget sama pas sma ya Di tanah rantau bener bener sadar kalo gak semua orang itu bahagia,gak semua orang itu tulus"
sadness,"Jadi, jika hari ini kita di hukum atas kesalahan kemarin, ikhlas saja. Karena buat penghujatmu... akan ada hari esok giliran dia terima konsekwensi atas kedzalimannya. Insya Allah"
love,"Adalah bapak yang setia mendampingi ibu. Adalah bapak yg terus berusaha melucu bikin ibu ketawa. Adalah bapak yg masih menganggap anak 24 tahun ini masih kecil. Adalah bapak yang paling cemburu ketika ada laki2 datang ke gadisnya. Luar biasa ya. Cinta sekali, bapak"
anger,"Suka kesel sama fans yang sok-sokan mengatur, sok-sokan yang paling tahu segala-galanya. Hey kamu ibu Negara bukan, cenayang bukan, sudah lebih baik diam biarkan dunia ini bersih dari segala macam bacotmu"
love,Jika kita mencintai seseorang.. Berusahalah untuk tampil apa adanya.. Karena cinta sejati selalu dapat menerima kelebihan dan kekurangan kita....
disgust,anies gak layak jadi pemimpin semua dibuat porak poranda kami jijik hti dukung anies hti
sadness,sudah ah jangan sedih katanya strong sel -adit
anger,WARGA MASYARAKAT SINGGAHAN TOLAK SEGALA BENTUK HOAX DAN MENDUKUNG PILKADA DAMAI . . . . #tolakhoax #lawanhoax #pilkadadamai2018 [URL]
disgust,lo jangan sasimo dong jijik liatnya tapi lo temen gue eh sekarang bukan sih
happy,Seneng banget dengernya congrats er sidang bakalan ada yg nungguin wisuda ada yg digandeng yuhoee
disgust,jijik bgt kepala gatel berminyak ketombean kyk salju mau buru buru pulang mo keramas
anger,Hahahha pengngangguran bisa makan dengan demo pasti otaknya minim ditambah dengan minum kencing onta lengkap deh tololnya
disgust,tangan ayang gue lu pegang berani banget lu ya jijik banget woy qcic
anger,[USERNAME] [USERNAME] Ooo... kl berisik emamg mendingan d sumpel si.. kl d kntr gw sepi bgt ki... jepangnya jg g doyan dgrin lagu.. jd mau g mau pk sumpelan kita.. bosen abisnya..
love,"9. Bibi Esta [USERNAME] OH MY GUD KESAYANGAN AKU BANGET, bibi baik bangett :* sayang bibi wkwkwkwk bibi asik banget, perhatian banget, aah sayang banget hiks sama bibi tiada kata yang mampu mengungkapkan rasa sayangku pada mu bi"
disgust,ga cukup pas dulu kamu ak yakin nanti juga bakal jijik wkwk
disgust,hari pertama kerja di pabrik astaghfirullah liat kamar mandinya jijik bngt heol
happy,"Be thankful for everything that happens in my life so far, its all an experience. . Iya captionnya gak nyambung sama fotonya, cuma sekedar berekspresi aja kok haha. . . . #waterfalls"
love,"Wanita akan menatap pria, kalau ada sesuatu di wajahnya atau jatuh cinta padanya"
anger,[USERNAME] Jangan krn save kampus ada alasan tuk memelihara pelaku teror di negeri ini. Sebaiknya Kapolri menawarkan FH dan FZ digaris depan dalam penggrebekan pelaku teroris agar merasakan ketegangan saat itu berlangsung. Aktivis bukan segalanya bila tak
happy,"Countdown to libur lebaran, keknya w mesti donlot banyak drama. Kan udah lebaran yakaan ga puasa yakaan gapapa kan nonton adegan unyu drama korya yakaan?"
happy,"sahabat el john bentar lagi [USERNAME] bakal ngebahas logo wonderful indonesia yang berhasil wara-wiri di moscow rusia, wowwww keren banget ya sahabat el john, info selengkap nya sebentar lagi stay tune ya!!!"
disgust,yg modelan begini nih yg bikin jijik karma apaan tadi hbj juga dicurangin besok tty kena karma juga kali menurut dia atau cuma berlaku ke atlet china ya
sadness,"Males packing tiap mau pergi tuh plg males kalo suruh packing,pgnnya bs punya tongkat sihir trus lgsg masukin barang2ny k koper dgn rapi"
happy,"Pak [USERNAME] sudah di pastikan akan terpilih kembali di pilpres 2019,.. Pesaing nya saat ini hanya proses Demokrasi saja agar dapat berjalan dg baik.pede bures"
disgust,liat yg jijik nderr
sadness,"[USERNAME] Ayah dari dulu sampai skrg bekerja pindah-pindah kota, saya merantau. Beberapa bulan lalu saya pulang ke Makassar, Ayah juga kebetulan pulang. tp tidak sempat ketemu, lalu di mnlpon mengajak makan bersama, saya tolak dgn alasan pergi bersama tm"
disgust,jijik bet ngapain per kota digituin mba nya intel kali ye wkwkwkwk
sadness,"Kalo cewe, ada opsi kak: Kalo gak pinter manage uang, yha punya banyak uang Karena kadang perkaranya itu soal gak mampu sih, bukan gak mau"
anger,Dasar mental maling.. Sdh diringkus masih salam metal.. maling tetap maling
happy,"TGB PILIHAN UMMAT Ummat Islam dari pelbagai penjuru negeri: Aceh, Padang, Riau, Lampung, Palembang, Kaltim, Sulsel, Papua, DKI, Jabar, Jateng, Jogja, Jatim, Bali, NTB, NTB semua menyatakan dukungannya kpd TGB. Karena mereka merindukan pemimoin yg amanah"
fear,Rasulullah.SAW Dan para Sahabat kenapa ga Kaya? Padahal Allah.SWT bisa memberikan harta yg byk utk mereka.karena pas saat mereka berkuasa.. Karena harta itu sebuah Cobaan bukan sesuatu kebaikan Allahualam
anger,"Tapi angin2an sih. Kadang ditindak, kadang enggak. Gak konsisten, jd gak fair. Siapa yg merasa gak fair, ya pmlik mbl yg pas parkir di situ, terus ditindak. Kitu sanes...??"
happy,"Sharing pengalaman aja, kemarin jam 18.00 batalin tiket di stasiun pasar senen, lancar, antrian tidak terlalu rame,15 menitan dan beress semua! Mungkin bisa dicoba twips, di jam-jam segitu  cc [USERNAME]"
fear,"[USERNAME] nyabutnya santae aja pake jari asal jgn kena kuku. beli softlennya yg emg bagus dan jelas. dulu ku pernah beli soflen di tmn cuma yg warna22an gt biasanya item. terus lg gangapa22in ujug22 gatel perih etaunya robek :,( untung cepet22 dikeluari"
sadness,Aku tidak membenci hujan sore itu. Aku hanya kecewa dia pergi saat mentari bersinar. Lenyap. Seperti kisahku dan kamu~ #masihtentangJuni #ceritaKaa
fear,"Sebelnya kalo udah anxiety tuh tbtb sakit perut, mual, panik, takut, ngerasa sendiri, sedih. Padahal yang gue hadepin bukan apa apa, tapi selalu anxiety duluan knp sih. Cape lho."
sadness,"Nb: jika anak didikmu tidak menyukai cara/sikapmu. Ubah! Kasihan, mereka tidak akan pernah bisa menerima apa yang engkau berikan. *Jangan mengajar dengan cara egois. Kami mencontohmu pakbuk 'siapapun' # curhatvan?"
fear,nyeberang lewat pelican crossing yang ada di deket UP aja masih ngeri motor mobil susah ngalah
happy,"Ya gini nih klo ada siluman bukber, fotonya kaga ada yang bener. Uda di sono paling lama, ditungguin sampe diliatin orang yang pada antre tetep aja anteng ngobrol ketawa ngakak. Ini nih pertemanan jastip terbhaiqq!"
fear,"Aku memutuskan untuk pergi sendirian karena aku takut tergoyah hatiku, dan aku takut teman temanku akan sedih tentunya. maka aku memilih untuk sendirian. Akan kurindukan Edinburgh Castle, Old Town, Princess Castle, Calton Hill, dan yang lainnya."
disgust,apa ga jijik ya itu waitressnya nyuapin wibu
anger,"Jadi waktu dulu ada yang ember ngasitau ke orangnya klo kita suka ama dia dan brusaha ngomporin supaya dia jangan sampe suka ama kita. Duhh pdhl klo kita mau bales mah situ udh masuk penjara kalii, sbagai otak pencurian hp temen sendiri di choir"
disgust,yo jijik lah pasti dia carrier penyakit kelamin tapi aku yakin lonte diluar sana bodycount nya sudah tagguh
fear,"[USERNAME] [USERNAME] Cerita satinah satu ini kayaknya emang 'beda' yaa.. Hampir semua reply bilangnya sama, degdegan, sampe ga berani biarpun cuma liat. Sampe sekarang aja aku gaberani liat pic nya .-."
anger,"Ya cma cara penyampaiannya diputer puter aja, pokoknya pia palen paling salah pokokmen. Gurl pantes aja Indonesia ini banyak org yg ngalami pelecehan seksual lebih pilih diam aja, ya gmna netizen macam lu masih banyak. Indon indon"
sadness,"Di malam ini, saat lagi terpojokkan memilih jalan. Dapet DM begini : kalo udah ada niat segera d laksanakan.. soale ntr d tunda sama dengan ga jdi wkwk biasane wkwk Lalu kutersedaq"
anger,"lalu aku komen begini ""min, kalo posting karya orang tolong minta izin terlebih dahulu dan tag si pemilik karya"" di feed tersebut namun tidak dibalas. lalu aku coba dm dengan kalimat yang sama seperti di komentar feed akun tsb"
anger,"BPIP itu : Badan Pembeking Instruksi Presiden Gak perlu ada BPIP sebagai Pembina..apakah orang2 di BPIP itu sdh super Pancasilais? kita tau semua apa yg di ucapkan dari mereka, dari ketuanya dan anggota2nya,sdh Pancasila kah ? mendingan uangnya utk mengefektifkan guru2 di sekolah"
sadness,"Jadi, ini hari ketiga gue kenak gondongan. Auk darimana asalnya. Udah gerah ini rasanya tiap malam gak bisa tidur karna nyerinya sampe ke kepala"
anger,bikin orang kesal saja
love,"Sayang banget sama orang tuaku yg satu ini.. selalu ada tempat untukku di hatinya.. Tempat curhat, tempat ngadu, tempat ketawa.. Selamat beribadah Haji menjadi Tamu Allah ya Bunda Sani dan ayah"
anger,"Entah kenapa kalau jam segini belum bisa tidur tuh jadi keinget sama masalalu. Dimana orang2 yg menatap gua dgn wajah sinis, dingin, acuh, berasa kek gua yg paling salah. Gua sih bodoamat! Cuma, entah kenapa mau bersikap baik atau suka dengan orang2 itu GAK BISA. #DailySinthaa"
disgust,tusk dan human centipede gokil bgt sangat jijik tp bagus ngerti gaseh karna w sukak bgt psikopat
fear,"ini gimana sih ngerasanya kosong gt, tombol ekspresi ntah dimana. dkit lg kalo ada yg tiba2 nemu trus kepencet kayaknya aku langsung meledak ini mah. bahaya."
love,Happy mansive Daddy wah udah 1 bulan aja. Aku beruntung banget dapetin daddy dan makasih atas selama 1 bulan yang udah kita jalani daddy udah buat aku selalu senyum. Aku sayaaangg banget sama daddy ga ngerti lagi sayang nya gimana.. Intinya I LOVE YOU!
disgust,isi chatku rada jijik i wkwkwkw lagi mode rukun sii selebihnya ra tau chatan
disgust,yg jijik banget yang bilang mau kenalan ato ajak foto dikira dia sapa
happy,Malam malam masih makan juga??? Efek perut kunyel kunyel kepengen diisi ya kayak gini Dinikmati wae Yo #anakperantauan #anakkost #maklumlahyo
happy,"[USERNAME] [USERNAME] ""Terima kasih yah!!! Aku happy banget tadi. Meskipun aku sampai muntah tadi dan sempat kesedak tetapi aku happy banget..."" #sedooooottt"
anger,Evaluasi dikit boleh x ya buat yg terlalu sering nyinyirin ttg masalalu negara. Bangun coi kita hidup di era kemunduran kemerosotan moral coi!! gimana caranya kita bangkit dari masalalu bukan sibuk ataupun asik mengkritisi masalalu tanpa memikirkan kewajiban didepan mata.
fear,"Rasa takut akan kematian adalah yang paling dibenarkan dari semua ketakutan, karena tidak ada risiko kecelakaan bagi seseorang yang sudah mati."
fear,"Terlepas dr agama ttp aja gamau oplas, banyak zonknya. Hasilnya kdang ga bagus dan kelihatan ga natural gitu soalnya ga cocok sm bagian wajah yg ga dioplas. Jadinya takut nyesel. Nanti jatohnya kecanduan dan ngerombak semua. Jd plastic monster dong"
anger,"Ga usah di aminin, doa lu ga akan mustajab. Sama kayak orang umroh dengan niat ""politik"" ga akan di qobul. Lu kira dngn kampanye sambil teriak takbir, sang Pencipta bakal ikut nyoblos #Mikir [URL]"
fear,"Bingung lvl bbrp bulan terakhir muka kering parah, pake yg biasa udah nggak mempan padahal biasanya kulit muka mentul2 lembab enak banget. Trusan ganti produk malah rusak mukanya, ganti lagi jadi mendingan tp msh kering. Dilema mo ganti lagi apa balik ke yg dulu apa ganti yg lain"
anger,Aman gmna mase. Org klo aman mah. Wsrga sekitar pasti senenh dong liat kaliqn dateng. Org bukti a aja warung dagangan di jarahin.. Itu maling kmrn gmna mase. Mending. Di urusin dulu. Biar gk panjang tangan [URL]
love,Istri nya aku cantik banget yaa tuhan pesek dikit yaa hidungnya kamu sayang [USERNAME]
love,Jika kasmaran adalah narkotik. Maka kau adalah bandarnya. Dan aku bagaikan pecandu yang rela menggadaikan jiwa demi menatap matamu sekali lagi. Garis Waktu [USERNAME] Pengen ngetag nama orang. Hanya saja... Ah Sudahlah
happy,"Hei remaja,Bangkitlah!!! Dunia ini bukan hanya tentang cinta,Harga diri ataupun Ketenaran.Tapi tentang Bagaimana kita berkarya,berinovasi,dan membangun negara ini."
anger,[USERNAME] [USERNAME] .... Ini aja membuktikan anda sudah TIDAK BENAR.....!!! MASA NAPI KORUPTOR BISA PUNYA HP DI PENJARA ITU SDH MELANGGAR ATURAN.... DAN ANDA DG ENAKNYA MELANGGAR ATURAN...!! INI MENANDAKAN BAHWA ITULAH KARAKTER ANDA.
sadness,[URL] Kabar duka datang dari ranah mode internasional. Desainer kondang Kate Spade tewas setelah gantung diri menggunakan scarf.
anger,"Aduh pemotor jgn suka ngerumpi di atas fly over daan mogot dong, macet tauk [USERNAME] [USERNAME] [USERNAME] [USERNAME]"
love,"Rindu ini mulai mencair, sebentar lagi menguap. Peluklah kasih, erat. Pasrah seakan jiwa kita ikut terbawa.~Tunaikan. #twittmalam #twittrindu"
sadness,[USERNAME] Gua kelas 1sd bawa hp karna buat hubungin mama. Tau tau dicolong temen. Gua diem aja bego emg. Bibi kantin ngabarin nyokap gua dan lgsg datang lah mama trs bapanya minta maaf. Eh beberapa hari kemudian anaknya pindah sklh. Ya
anger,[USERNAME] [USERNAME] sebenarnya yg Melanggar Bawaslu itu Lawan Politik nya apa beliau ??? ah sudah lah makin terjun aja tuh image beliau d masyarakat
disgust,ini jijik x sumpah
happy,"...dan apa saja yang ditahan-Nya maka tidak ada yang sanggup untuk melepaskannya setelah itu. Dan Dialah Yang MAHA PERKASA , MAHA BIJAKSANA. Qs Al Fatiir : 3"
love,ini knapa menurut sy bagusnya Al Qur'an itu bukan sekedar dibaca.. dalam tafsir juga kadang ada penyebab knp ayat tsb turun.. yg bawa arti yg atas adalah tafsirnya [URL]
disgust,jadi keinget malem disuruh nangkep cicak mati sama ayah waktu itu abis solat berjamaah ayah suruh aku ambil sapu kecil trus disuru ambil cicak mati di lemari cicaknya kecepit bener bangkainya doang kan aku aga ew wkwkwk jijik dkit tp ttp aku ambil
anger,Semoga roboh dan menimpa mereka. Baru kemudian akan ada himbauan keras untuk tidak naik-naik sembarangan ke atas situs sejarah. Sadis? Terpaksa. Pekok berjamaah. Garansi seumur hidup. [URL]
anger,#CalonPenghuniNeraka INI SERIUS Buat elu semua para player troll player toxic player noob terutama di game vainglory Elu gak gue maafin. Jancok Neraka bangsaaaaat
anger,"Untuk cegah radikalisme? Mohon deskripsikan dulu batasan radikalisme. Kalau batasannya berupa kriminalisasi ajaran Islam, itu namanya radikalisme Sekuler. [URL]"
love,makasih ya buat semangat dan do'anya :-) peluk cium {} :
love,"Tamaki sedikit menggerakkan kepalanya sampai bibir dapat menyentuh sebagian dari atas kepala Haruhi, "" ia mengecup kening sang kekasih, """"Kalau begitu aku sepuluh kali lebih merindukanmu."""" Bisik Tamaki."""
fear,"Dari mulai disuruh2, dibentak, dimarah-marah. Untungnya sih ga ada kekerasan fisik ya, tapi dari segi mental itu yang jadi kita takut/ga nyaman buat pergi ke sekolah kita sendiri. Walaupun katanya cuma akting, tapi tetep ajalah ngebekas."
happy,"Kalo ga u [USERNAME] , mba muth yang ngeblurrr... Wkwkwk ada aja sih yg ngeblur foto terakhir semuanya blur na wkwk [URL]"
happy,"[USERNAME] [USERNAME] [USERNAME] Maksudnya al sama adam, tuh, kembar, sha. Sama2 22 mei. Jadi koplaknya sama, gitu. HEEET NYAMA2IN AJA NIHHH [URL]"
anger,"memasuki tahun ke 4 menunggu seseorang, eh ada yang lain dateng tapi ga tanggung jawab sama kelakuannya... besok kalo keluar2 pake rok aja mas"
sadness,"Seharusnya gue bersyukur dikasih rezki bisa sekolah sampe tinggi dan di tempat yang yah bisa dikatakan fasilitasnya selalu ada dan lengkap. Sedangkan mereka? Setiap ke sekolah harus naik kapal compreng yang jaraknya cukup jauh dari rumah mereka, hebatnya lagi mereka nggak ngeluh"
anger,teman kamu yang sudah nusuk kamu dari blkang malah dialem2 seandainya mulut saya bocor sudah bertengkar kali kamu ber2 sayngnya saya gabakat ngadu2an -_-
fear,[USERNAME] [USERNAME] [USERNAME] Iya.. berbagai macam cara aja dilakuin. Udah nekat masuk tol. Padahal membahayakan diri sendiri dan orang lain yah. Gak kebayang kalo ntar ada yg nekat masuk tol yg mayoritas kendaraan besar. Ngeri sendiri bayanginnya
fear,"Tapi aku mengerti, memang akan selalu ada yang terlihat lebih baik dari apa yang dia punya. Akan selalu ada orang yang terlihat lebih menjamin banyak kebahagiaan untuk dia dapatkan. [USERNAME]"
disgust,yg film nata itu deh judulnya lupa paan itu serruu lucuk agak jijik tembak an darah gtu wkwkwkwk
happy,"Beberapa orang tetap bisa menikmati hidup walaupun belum di pertemukan dengan pasangan karna ia memiliki sahabat dan banyak teman .. Dari orang2 terdekatnya, ia tak pernah merasa kekurangan kasih sayang"
anger,"[USERNAME] pelayanan CS di BRI Surabaya Pahlawan kenapa lama sekalii? Ini sudah 2 jam urutannya cuma jalan 10 nomor, yang 5 nomor kosong, berarti cuma melayani 5 orang dalam 2 jam."
fear,"Niat awal mau belanja online, tapi begitu tau ekspedisi lagi overload dan itu pasti bakalan lama bgt nyampenya mending batal dari pd tiap hari gegana nungguin paketan"
fear,"jd kmrn dpt tmpt ujian di smp 5 trus pas survey ruangan keinget pernah baca artikel horror (lol) krena emg tmptnya bnr2 serem, baru masuk udah merinding, iseng habis ujian cek lagi artikelnya dan baca2 komen alumni di sekolah2 yg ditulis angker"
happy,sukaaa bangeet dan suka telat emang wkkw. yang tau lagu ini notabenenya pas di konser . maap ku karbitan otw bucin huhuhu nangis dompet saya. [URL]
happy," iyaaa, paling demen klo bahasanya udah aku kau atau aku kamu gtu btw ada rekomendasi ff nct yg bagus tak? klo bisa yg udah complete tpi klopun belom klo bisa yg updatenya cepet wkwk"
anger,ini hasil sekolah asal sekolah ... mikirlah Mahkamah Internasional itu punya kewenangan mengadili perkara genosida dsbnya ...
