label,tweet
happy,Akhir akhir ini banyak ketemu orang orang baik. Padahal umur mereka masih muda tapi masyaAllah ibadahnya luar biasa. Aku waktu ukur segitu ngapain aja? Sibuk sama oppa korea
anger,"Benar2 hancur negara ini dikelola amatiran, tp kenpak [USERNAME] tidak mengindahkan statementnya sendiri? Negara miskin koordinasi, jangan asal gagah2an .. setalah salah dianulir mana marwahmu wahai mr. [USERNAME] presiden? [URL]"
disgust,banget walau di awal aku rada ngangngengngong sih kek sulit di cerna wkwk iya ih aku juga jijik kek tidur sana tidur sini tapi akito juga begitu si
disgust,tbh di aku gak yg bikin eneg muntah jijik tapi lebih ke linu aja dan tadi nontonnya jg masih bisa sambil makan
disgust,nderr sakit banget aku juga pernah dibilang jijik gt grgr outfit smpe skrg masih keinget bgt ucapan temen sma ku itu smpe mikir emg sbgitu jijikah aku brpakaian jg sopan smpe akhirnya kita jrg kontekan lulus kuliah trs kerja dia tbtb chat bilang kalo skrg insecure sm akuu
happy,"Jiyeeee jiyeee, jeng Domi abis menang lawan Kei langsung di sambut hangat girl friend Kimlad. Halaaah sandiwara [USERNAME] [USERNAME] [USERNAME] [USERNAME]"
sadness,"Segala sesuatu yang kupelajari selalu saling jepit--saling kait. Seni, politik, sastra dan mungkin yang kupelajari saat ini adalah jembatan panjang yang tak tahu akan berujung di mana. Hidup adalah pencarian yang tak putus. Termasuk juga mencari tahu siapa diri ini. :)"
happy,Terima kasih mommy Jesica atas kepercayaan kepada [USERNAME] untuk treatment selama kehamilan nya. Semoga sehat dan lancar semua yaa mom
sadness,"Ada kawan mengeluh disuruh lanjut S2 sama bapaknya, biaya udah disiapkan, tapi dia nggak mau. Kutanya: bapakmu nggak mau ngangkat anak lagi untuk di-S2-kan? Si kawan tadi cuma nyengir."
anger,Sering jd bahan diskusi kita mlht kondisi Indonesia bbrapa thn terakhir ini utamanya..sbg warga negara yg peduli thdp situasi yg dirasakn.. Klo mlht latar blkg pdidikn sy bpk akan tahu sdri.. [URL]
fear,"[USERNAME] aku udh takut bgt nih soalnya rata2 yg pengen fk di sekolah aku aja rata2 anak paralel :"") tp gatau jg ya kalo univ yg dipengen beda"
anger,"Sumpah ya gue komplen masalah duit yg kedebet di BCA cepet dikembaliin daripada di B*PN. Di BCA cuma sehari, di B*PN uda berminggu-minggu belum dibalikin. Padahal nominal yang kedebet gedean BCA kemana-mana. That's why I cinta BCA. Your service satisfies me. Always."
sadness,"Apa cuma gue disini yg berpikir kalo perempuan tidak pernah menjadi pemilik seseorang secara utuh & hanya milik suami beserta keluarganya dari perspektif agama? Agak disturbing sih buat resolusi konflik rumah tangga sedangkan karakter ortu suami & suami jelek, istri kudu piye?!"
anger,"Siapa sich yg dipercaya FZ polisi yg sdh bekerja dg tepat wkt dan cekatan, tetap ga di percayai, mungkin hanya di sekarang lari ke arab itu aja yg dipercaya, bgmn rakyat mau percaya FZ dan FH yg selalu nyinyir tanpa bukti"
fear,"Baca2 tentang vaksin di akun ini kok serem kali yaa. Ayuka vaksin terus sesuai jadwal padahal. Tapi kalo kandungan vaksin semenyeramkan yg dijabarkan di akun ini, kok was was jg. Tega kali orang2 di belakang... [URL]"
anger,"diatas langit masih ada langit tp bagi saya kepentingan politik luar negri hrs pragmatis mendukung kepentingan domestik bkn sekedar sentimen. Negara donor terbesar Palestina US , kmn Turki dan Arab? Kenyataan yg hrs anda pelajari"
happy,"entah baper atau apa tbtb pengen post ini, hahah so grateful to have known them dari melakukan hal tergoblok, main game saat pelajaran, kabur ekstrakulikuler, dihukum guru, minjem tugas, nyontek, makanin temen, ngebully sampai ngambek. [URL]"
sadness,Ada mama murid yang rikues anaknya masuk di kelas saya. Di saat yang sama banyak murid yang hopeless ketika tau bakal masuk di kelas saya karena rumor yang beredar saya guru galak
anger,Cara batalin tempat sampah made in jerman yg sudah terlanjur diadakan oleh gub sebelumnnya gimana pak??? Apa kita belah jadi dua biar ahoker pada happy?? Kalian ini kok kerjanya nyinyirin gubernur anies bae.. 
disgust,jadi jijik
anger,"Waktu kalian jd oposisi Era Pak Harto, Pak SBY, kalian mudik lewat Jalan Tol, jembatan, pelabuhan, yg dibangun era Pak Harto+SBY ? Logika dipakai. Admin Dungu bikin Anjlok Elektabilitas Pak [USERNAME] cc [USERNAME] [USERNAME] [USERNAME] [USERNAME] cc [USERNAME] [URL]"
happy,Tadi sempet swafoto bareng pesinetron komedi TOP (Tukang Ojek Pengkolan) : Mang Odih alias Om Kusye. .. Yg membanggakan adalah si om menjadi saksi mewakili dari pihak perempuan (keluarga [URL]
sadness,"Bunga mawar pun memiliki duri, jikalau memang kita menginginkannya mungkin akan terkena sedikit goresan pada kulit. Begitu juga hidup ini, kadang kita harus merasakan perih ataupun luka untuk menikmati kebahagian didalamnya JAR"
happy,sore-sore nyomay enak nih hq indosat m2 grafiti building 2nd flor)
fear,"Biasa di negeri orang, taat aturan. Pulang ke indonesia sudah 3minggu masih kebingungan. Kalau ga jahat bakal di jahatin orang disini mah. Bener bener"
happy,SUNDA KELAPA Alhamdulillah abis tarawih di Masjid Agung Sunda Kelapa. Nikmat sekali. 23 rekaat tapi nikmat karena bacaan imamnya mantap. Ini masjid persembahan Gubernur Ali Sadinin utk masyarakat Jakarta. Yuk coba tarawih di sini Pak Gub [USERNAME] dan Pak Wagub [USERNAME] [URL]
happy,"Untuk beberapa waktu biarlah kita bekerja sebagai bawahan, kelak kita bangun usaha sendiri, jadi pengelolanya sendiri, jadi bosnya sendiri, jadi petani yang selalu bangga dengan usaha sendiri. #nonelse"
love,"Ada waktunya, sayang berubah jadi butuh. Perhatian berubah jadi pengertian. Percaya berubah jadi yakin. Itu semua akan terjadi kalau kamu dan dia saling melengkapi. Tidak mencari kurang. Tidak mencari salah. Tidak mencari yg lebih."
disgust,orang kalo dongo ya gitu ngasih alamat aja ketaker otaknya yang sesendok teh pondok lestari ga sebut nama kota dan keterangan lain nya ya elu kan asu nya dirumah itu gua digigit elu mah jijik cakepan juga lonthe michat ama lu
disgust,cowo pick me lebih jijik ya ternyata haha
disgust,gw gak suka orang lelet sama mencoa mencle jadi kalo lo paket lelet iya mencla mencle iya kebayang gak jijik gw sama lo gimana
disgust,wkwkwk menyulut kemarahan orang memanas kan eh ujung nya jualan heran jg org sprti ada yg denger ya padahal nih org sprti org sakau ngomong aja gak jelas jijik bgt liat org spek bgni
love,"94. Dear member livable Mince sayang sama kaliannn, mince akan berjuang buat kita semua.. Tapi kalau gk ada dukungan dari kalian mince bisa apa.. Makasih udah nemenin mince di livable ka, minceee sayang kk livable"
fear,"Si Dera aja, akun alter yang suka flashing her boobs once in a while, bilang dia merinding ngeliat siksaan demi siksaan yg gua alami ahahaha [URL]"
sadness,Apa mereka enggak pernah ingat kalau nanya kabar itu juga penting? ah atau saya saja yang sedang kesepian. Itu semua normal gak ada yang salah dengan kondisi seperti itu.
fear,"gila takut banget gue kaget gitu gue sampe loncat larinya kaget bat. hufh tapi abis diluar gue minta temenin satpam. satpam nanya kenapa emang, gue bilang pintunya ga bisa dikunci. alesan doang gue takut kalo ngomogin langsung soalnya gais. hufh. -END-"
happy,"Alhamdulillah Kembali ke kota pahlawan dlm rangka mendampingi teman2 peserta diklat , Smg mndapatkan inspirasi yg trbaik sbg bekal fase kediklatan berikutnya...."
sadness,astagah! sifat humoris scorpio adalah sebuah topeng untuk menutupi semua luka hidupnya #kiscorp
fear,"Jd kaya kebalik gitu. Dulu socmed jd escape buat gue ekspresiin kegilaan. Skrg berhubung socmed jd lebih serem dr dunia nyata, eh jd dunia nyata yg gue jadiin escape dari socmed."
anger,"Gue suka bilang, sebentar siapa yg perawatnya? dan trs kan kita kolab sama advice dr. Ya kalo klien yg paham sih lgsg oh iyaaaa maap soalnya nanya. Tp kalo yg kmpret mah lgsg komplen  rasanya ingin kuteluh saja tu org sumpeh"
love,"heunggggg enggak malah aku sayang banget sama nenekku like tiap hari gak ngunjungin rumahnya itu kayak ada yang kurang. dulu tiap mau pergi sekolah, les apa main pasti ngunjungin rmh nenek di sebelah rumah dulu"
sadness,"Setelah 20hari puasa dan saur gak pernah kesiangan, akhirnya di hari ke21 ngerasain makan saur supeerrr dupeerr ekspress, 1menit sebelum imsak baru bangun yassalaaam"
anger,"Untuk kesekian kalinya complain via socmed selalu dibalas dengan ""template"" yang selalu sama dan tidak memberikan solusi. Apakah sudah SOP nya seperti itu?"
happy,"Buat berjuang, butuh sarapan yah, nah ini dia sarapan q, Indomie Goreng Telor Puyuh  Yummy bangets rasanya, Apa sarapan kamu biar kamu makin Bersemangat ngejalanin aktivitas"
sadness,"Ada orang yg berubah, jadi lebih positif atau negatif, kita ga pernah tau the biggest reason kenapa dia berubah, kalo salah ya dikasih tau jangan dihujat"
disgust,terverifikasi dia sebenernya jijik tau gin wkwkwkwkkwk
happy,"Baru tau kalo anak sd sekarang ga pake buku tulis kudu disampul coklat. Mereka menggunakan binder file. Keren lah, gue ga perlu repot sampul menyampul belasan buku"
disgust,kontol gua auto insecure baca lu ngetwit sayang jijik
love,"Meluk adek. ""Sayang yang sabar ya. Adek lagi hamil kan. Jangan emosi mulu, bahaya loh buat kandungan adek. Kan Vian udah bilang juga, ya?"" Mengecup kening adek."
anger,"Mak Lampir dibully karena memberantas nyamuk yang tidak pernah tuntas dan selalu gagal menyelamatkan sang penguasa akan tetapi selalu tampil seolah-olah apa gicuuuuu, padahal kita semua sudah tahu dari dulu bahwa ..... aaahhhh sudahlah ......"
anger,"Seandainya 2019 jokowi kalah sdh dipastikan : HTI bangsat bangkit, teroris bangsat bangkit, Radikal bangsat bangkit. Semua politik balas dendam bangkit. Yg minoritas ditekan.. mending memisahkan diri dari NKRI.. untuk itu harus 2019tetapJokowi.."
happy,"Cab. olahraga baru di [USERNAME] , Pencak Silat akan jd salah 1 cabang andalan utama kita utk meraup bbrp medali. Selalu happy olahraga beladiri. Beberapa thn belakangan mulai belajar Silat dikit2. Sblmnya sejak usia 5 thn tekuni Karate & Taekwondo"
love,"Wajar gak kalo cowok nangis gara-gara nahan kangen? Soal nya gak bisa sama sekali untuk ketemu hehe. Lebay gak sih? engga dong, artinya itu sayang. nahan kangen sampe nangis jarang sih gue ketemu yang kaya gitu wkwk [URL]"
fear,"Tapi kadang terasa dilema. Ibarat orang yang menikah lalu menghadapi KDRT, tentu ada trauma besar ketika hendak memulai hubungan baru. Begitu jg aku. Aku menjadi rendah diri dan trauma mencari pekerjaan baru. Mentalku sudah jatuh. Aku hari ini tidak lbh dari loser"
happy,[USERNAME] Sukses dandim1621 tts tugas mulia brsama rakyat berhasil nambah kemajuan desa sukses pak babinsa met tugas mulia kian kuat tni brsama rakyat jayalah nkri
fear,"Francey agak terkejut saat mendengarmu meneriakinya. Seolah jiwanya melompat seperti seseorang yang sedang menonton bagian jumpscare dalam sebuah film horror. Wajah Francey berubah, ia agak ngeri dengan wanita disebelahnya ini."
fear,"Lagi hamil dan ikut tantangan in my feelings, gerakan Cherly Juno bikin ngeri! Dengan perutnya yang sudah membesar, begini goyangan Cherly.. [URL]"
anger,"Hah ! Ini bener ya?? Kalo bener, Astagfirullah...Masya Allah...Naudzubillahminzaliq !!! Partai Islam...Partai Allah. Kelakuannya...SETAAAN !!! [URL]"
anger,"Paling kesel sama orang kalo lagi duduk lesehan gitu padahal masih lega, tp dia lebih milih deketin kita trus niban dengkul kita sama dengkul dia [URL]"
anger,ni wasit kemarin kepemimpinan nya bagus sekarang apan!
disgust,aku juga pup ponakan pup murid mau muntah anak sendiri awalnya jijik tp lama biasa soalnya mau gamau ngurusin apalagi kalo udh bulan udh makan macem makin bau masih kadang gakuat tp sok kuat aja
fear,Tengah baca thread seram tetiba nmpk benda hitam gerak dekat tepi kepala. Dah la dalam thread tu cerita dah sampai dekat bayang hitam. Cuak wehhh . Tengok sebelah nasib baik sarung bantal je bergerak .
happy,[USERNAME] Alhamdulillah pak panglima n pak kapolri dgn selamat ditujuan kian sinergi tni n polri utk seantero nkri met tugas n sukses selalu
happy,"Satu lagi, pilihan 'menikah' tidak ada didaftar pilihan. Haha  Jadi, intinya saya ingin membebaskan pikiran saya, pilihan2 hidup saya tanpa intervensi dari pihak manapun."
happy,"Udah ah makin ngelantur wkwk.. Pokoknya niatkan utk ga pake bulu mata palsu. Jgn khawatir bakal ada rintangan ini itu, yakin aja klo niat baik pasti Allah bantu. Smg segala niat dan langkah baik kita (termasuk ninggalin bulu mata palsu ini) Allah kasih ganjaran surga ya"
anger,"semoga kedepannya ga kejadian lagi Barista [USERNAME] Gancit ngeselin. Masa pesen espresso yg harusnya pahit jd manis. Kopi yg kamu jual bukan barang murah loh, jd wajar klo yg dicari kesempurnaan rasa. baru kali ini ada barista kayak gitu."
disgust,kecebong kan d got n comberan banyak makanya aku jijik
fear,"Maka yang dilakukan papa adalah dudum diruang tamu, dan menunggumu pulang dengan hati yang sangat khawatir Dan setelah perasaab khawatir itu berlarut-larut. Ketika melihat putri kecilnya pulang larut malah hati papa akan mengeras dan papa memarahimu."
fear,"Sekarang gue kerjaannya cari info, cara ibu yg baru melahirkan buat refreshing. Karna kalo ga refreshing, tubuh ga bisa bohong ga sih? Takutnya drop dan malah ngaruh ke si bayi"
sadness,"Ketika ada sesuatu hal yang membuat kita jatuh, Percayalah bahwa kita sedang diajarkan bagaimana cara untuk bangkit"
sadness,"Ketika liat anak keputih korban kebakaran, lingkungan mereka ga mendukung. Adik2 nya bener2 kek yg berani sama org yg lebih tua, gaada sopan santunnya. Melihat kondisi sprt itu ada yg bilang anak jaman sekarang emg bandel2 gitu. No guys, kalo lingkungan mereka baik pst ga gitu"
happy,"Berita baik hari ini, Alhamdulillah Kim #KAI buka Instagram lagi. Karena dulu belum sempet jadi soel pas dia punya akun Amteun welcome back Mr. Ato #KaiOnInstagram [USERNAME] Also goodnite wangjanim [USERNAME]"
anger,Padahal yang lain senyum ramah lohh sama fansnya. cuma kamu sendiri yang agak angkuh!! Rodo ngadoh piee ngono nek tak rasakne sumpah wagu mas polahmu
fear,"Anda ingin merasakan cinta terindah..? Ketahuilah tiada cinta lebih indah dari cinta pd kekasih, Sayyidina Muhammad SAW.. Saat bibir anda bershalawat pd beliau, lalu hatipun bergetar terpapar cinta tak bertepi sang Nabi pd kita, tulus, suci & tak lekang sampai Kiamat"
happy,"Malem ini nyoba bikin overnight oat yg kadar pisangnya lebi banyak daripada oatnya  Tida lupa ditambah chia seeds, madu, dan vsoy  Semoga sahurqu nanti lebih manis daripada angan-angan~~ [URL]"
love,"usaisenja : SrikandiIndung Seseorang pernah bertanya padaku, seperti apa cinta itu? Cinta itu seperti, Sekepal jantungku yang tak bisa melupakan degup Sebentuk paru-paruku yang tak bisa meninggalkan udara Dan seperti aku yang tak bisa kehilanganmu. #us"
fear,Last time aku tengok maya karin kat pontianak pon dh buat aku takut makan kat meja makan sbb ada hantu bawah tu.... Now munafik 2? [URL]
sadness,"Jika Engkau menolak sebuah ketulusan, Janganlah kau menolak,,, karena jika engkau menolak mungkin dia hanya senyum saja atau diam menganggukkan kepala, namun seseungguhnya dia tak marah melainkan sedih. Jika engkau buatnya sedih Niscaya akan sulit lagi datang ketulusan,,,"
anger,"Nggak ""Ok"". Saya dulu pengagum [USERNAME] . Sekarang GAK respek"
anger,[BELAJARLAH DEMI ORANGTUAMU!!!] KALIAN TAU!! Orang tua kalian telah banting tulang untuk kita Panas ke panasan Hujan
love,"Setiap kesempatan yg pernah hadir tuk dapat membuatmu selalu merasa aman dan nyaman, kini jadi suatu kehormatan yg pernah didapat"
disgust,emng dengan fb elsa sarah dulu bikin gw sedih ga si malah jijik
happy,"Oh seperti itu a. Seru dong ya Semoga terus sukses a. Walaupun tak lagi mendengarkan suaramu dibalik radio, tapi mungkin akan membaca karyamu. "
anger,"Untung ga ada yg nanggepin. Mayan malu kan kalo ngomong di grup ga ada yg nanggepin? Kadang kalo g ada yg nanggepin berati orang2 udah ngerti apa yg kamu maksud. Ga tujuan kamu ngomong seperti itu. Not funny to discuss, sis. perlu dipertanyakan lagi maksud &amp"
sadness,Saking sibuknya aku lupa jam 4 mv rilis. Iya sibuk. Sibuk nyari kesibukan sambil baca ebook. Heran! Accounting apaan awal bulan ga ada kerjaan.
happy,"[USERNAME] Wkkwkw emang sifat bawaan dari lahir sih iya, selalu mao hasil yang terbaik... Bawa santai ajja sih, nilai kuliah nanti juga gak terlalu pengaruh buat kerja. Lebih penting softskill kan, dan kamu softskillnya udah salah satu yang terbaik di"
sadness,Terbege lagi adalah tadi. Sudah alarm jam setengah 3 sudah keluar kamar buat bangunin tmn eh temennya ga bangun trs ke kamar lagi eh tidur bangun2 pas adzan subuh. Belom sahur. Oke syap
disgust,aku juga jijik sih sama diri aku
happy,"Belum pernah foto berdua.. cm ada foto ini.. . . Happy blessed day Pak Guru Bonar Sihombing..!! . . Panjang umur, sehat selalu dan senantiasa diberkati"
sadness,Penerimaan siswa Sek Neg favorit dgn sistim zona byk menuai kontra khususnya bg siswa yg pandai ortunya tdk mampu. Perband 85 0/0 : 15 0/0 yg mampu &amp
fear,"Ini hanya hal persepsi dlm mendidik. Dan smoga sy bukan termasuk dlm ortu yang mendidik dg memukul anak di depan org banyak. Tak akan pernah, semoga."
anger,[USERNAME] saya rasa pantas anda dicemooh oleh orang banyak karena kalau anda mau dihargai maka hargai pembalap lain terutama yang sudah jauh lebih senior dari anda
anger,"[USERNAME] LU KIRA SEMUA ORANG PAS NGENTOT SADAR DIKELUARIN DIDALEM, PAS LAGI ENAK-ENAKNYA SEMPET GTU MIKIR KELUAR DIDALEM APA ENGGAK YA? ANJIR INI GUA JADI DARAH TINGGI MASA :("
fear,[USERNAME] Takut dikira fitnah tp emang bener adanya huhu yaudah lah ga mau macem macem di internet nanti aq diblacklist sama holcim asli:(
disgust,aku ternampak member lelaki aku punya kuku jari hitam euww bodo la jijik dah jam aku masih terngiang ee setan
love,"Seyakin apapun diri ini, diri kita semua, seyakin apapun itu jika ketetapan Allah yang demikian ya bisa berbuat apa?, tak ada daya, selain 'the power of doa'. [URL]"
love,"Kuakui aku jatuh cinta pada aksara, Oleh sebab itu aku bisa berbicara pada semesta walau hanya lewat untaian kata tapi yang kuceritakan ialah tentang kita"
love,"Walau kau menghapus menghempas diriku Mengganti cintaku Semua tak mampu hilangkan cinta Yang telah kau beri~ Walau kau berubah, aku kan bertahan Di sepanjang waktuku Biarkan aku mencintaimu dengan caraku"
happy,"gak berasa puasa sdh 20 Hari, & sbtr lagi lebaran,ada rasa sedih krn ramadhan akan meninggalkan kita, tapi ada rasa happy krn sbtr lagi kita akan lebaran,berkumpul bareng keluarga,saling memaafkan & kmbli fitrah...smg saya & kita semua akan bertemu lagi ramadhan 1440H/2019...AMIN"
sadness,Semakin dekat dengan orang maka yang sangat diperlukan itu sebuah pengertian yg besar... Ngerti kalo dia banyak kekurangan dan kamu juga begitu... Ini susah banget sih dilakuin di kehidupan nyata... Heemmmm
disgust,reflek nih ak bilang ih yek serem trus ayahku malah bilang gini knp jijik sih kamu kan gizi pasti motong daging hewan jg ok disini aku terdiam ngelag dikit apa mkstny ini bapak prodi gizi mah motong daging ayam sapi dll buat di masak mana ada daging cicak
sadness,"[USERNAME] Aku diem, karena nahan ngomong yg nanti takute melebar sampek mana - mana. Dia mencoba tanya ""kenapa diem?"" aku tetep diem eh malah dia ikut diem dan merem :')"
happy,"Gilak! G1 aja begini. Rakan dkk diborong. Mungkin kalo masuk 5 momon, Zeratu pun ngikut kali. Triple S pula aaaaak *droolin [URL]"
love,"[USERNAME] dia nih manusia yang tibatiba nyita perhatian gara2 kukira dia orangnya kalem ternyata allahu bobrok banget, tapi tambah bobrok tambah cinta huhu bucin bgt sori:)) [URL]"
disgust,jijik retweet kyk giniancm kadrun bego aja yg mau retweet
happy,"Semoga secangkir Toraja bisa menjadi teman penyemangatmu, yuk beraktivitas!"
fear,"Area Alor Gajah, masjid tanah, jalan nak g pengkalan balak etc tu, kalau boleh mmg aku elakkan jalan malam malam. Oh seram."
anger,"Udah mau sarjana 2 kali, mbokya mulut nya jangan ketinggalan buat belajar. Sekiranya itu ga perlu diungkapkan, nambah dosa + nyakitin hati orangnya mending diem2 bae lah. Kasian anda nya yg di julidin sm orang."
fear,"Anjrittt serem sendiri. Td pas pulng kantor krna jarak kantor ke rumah naik motor kuranglebih 50menitan. Dri pd ngantuk suka nya ngomong sendiri atau sok2an lg ngobrol sama siapa gtu (jng bilang saya gila, obat ngantuk saat nyetir). Nah tema hari ini comeback ftisland."
fear,"[USERNAME] takut banget,takut d bawa kabur soalx dulu pernah pengalaman dibawa kabur keluar kota untung ada bang ojek yg bisa bawa daku kabur waktu mereka pikir aq g bakalan lari hmmmm mereka g tau aq pux duit 30 ebong buat ngibrit"
disgust,ngeliat temen laki br putus trs show off cewe baru terus tuh jijik ya ternyata br kali ini gue enek ngeliatnya bro u look so cheap and desperate
disgust,jijik sama humblebrag kontol anjing begini
disgust,anjing emang yg sebar foto bom bunuh diri astana anyar jelas bgt anjir badan nya kepisah aing org nya takut an dan jijik an sm yg gtu bgst lgsg mual
love,"Lgi ngumpulin upeti kanan kiri... Mau ngasi hadiah buat suami panerai... Bukan anniversary/ special day.. Cuma krn pengen kasih aja... Krn memberi lbh membahagiakan drpd menerima  Ngasi suami sendiri itu gpp, *Kl dulu njum suka ngasi ke pacar2 an alias zonk lahir btn"
fear,"dilema, mau testing prod version (di prod environment) mesti downtime karena kalo kagak takut ganggu operasional aplikasi eksisting yg masih jalan, selain itu juga bikin data kotor."
sadness,"Pesan gambar masuk, isinya gini: Batas menyelesaikan kbt sampe tgl 10 juli, lebih dari itu dicabut dari sk yudisium dan daftar wisuda, dan auto bayar ukt Mules dong, ternyata bukan fakultasku~ bye"
happy,"Sama kayak bahagia. Mau gimanapun persepsi orang tentang bahagia, kalau bahagiamu memang beda dari persepsi orang2, itu tetap bahagia kamu. Orang lain gak ngerasain, tapi kamu yg ngerasain ttg bahagia kamu."
sadness,"Main ludo lawan komputer aja masih sempet kalah, gilani. - izam. Gpp yang penting pernah menang :))) biar ga jadi loser terus. [URL]"
happy,Ini justru bagus. Dengan ini semoga dangdut kita bisa menaklukkan asia tenggara. Nanti nya kita tidak hanya mengirim TKI tapi pedangdut. Yeay!
disgust,aku tidak masalah dengan orang yg memiliki prinsip namun aku jijik terhadap orang yg mengkhianati prinsipnya sendiri
sadness,Polres Pati Berduka : pada hari Senin (09/070 bertempat di rumah duka Ds. Waturoyo Rt 03/IV Kec. Margoyoso Kab.Pati telah dilaksanakan giat upacara persemayaman Jenazah almarhum AIPTU PURYONO jabatan terakhir Banit 1 Unit Sabhara Polsek Margoyoso [URL]
love,"Dengan bumbu kasih sayang Aku masak menu favorit mu ""Semur Lidah Sapi Badranaya"" Siap untuk dihidangkan Untukmu duhai pujaan hati "
sadness,dari kemarin mao ganti ava susah sekali sudah
happy,"Bahagia donk ... diajak jalan ke Mall ... suruh jajan ... dan yang pertama di jajanin si Mungil, kemudian galau lihat baju ungu cantik klo bilang pengen itu sih diiyain aja sama Dia, tetapi emak kudu waras dikit"
fear,"[USERNAME] kalau untuk barang elektronik gitu gimana? kadang takut mau buang headset dan baterai ke tempat sampah. soalnnya kan bahaya...trs sama botol spray, katanya bisa meledak di suhu yg tinggi.."
anger,"Seharusnya lu belajar dari kasus lama lu, untung itu ga diusut, harusnya lu kapok dan belajar dari temen-temen lu yang udah ngerasain jatoh. [URL]"
anger,"Logika aja katanya, tapi tweetnya muter-muter di situ aja. Pakai perbandingan Nikita Mirzani dan DP lagi. Yaelah. Kecoak terbang! [URL]"
disgust,klo si mpud dipasangkan sm anies gue jijik bngt sm si mpud
happy,"Selamat ulang tahun, Bosque! Sepurane telat. Semoga2 sehat selalu, dilancarkan karir & jodohnya"
happy,"Udah gak sabar nunggu perhelatan #InternationalGamelanFestival2018 . Solo sedang bersiap menerima kedatangan lbh dr 50 kelompok gamelan dari dalam & luar negeri, dlm pergelaran IGF 2018 yg diadakan 9-16 Agustus 2018"
fear,"Cuman bedanya si emang adek gue suka gt sama bau2 kesehatan jd emang masih agak niat lah. Lah gue emang asal aje daptar2 mana aja maklum lah pas itu masih takut kalau ga kuliah, tp berasa si kuliah di tmpt yg bukan passion. Kesan nya kayak budak nilai."
happy,Kegiatan Ibadah Sholat Dzuhur UILS Koja. Penerima Manfaat bersama Petugas Pendamping melakukan ibadah sholat Dzuhur berjamaah. Indahnya kebersamaan [URL]
disgust,kadang jijik si ngelakuin ini wkwkw
happy,"5/6/15 Tiga tahun yang lalu, pertama kalinya ngenalin cowok ke orang tua dengan modus si cowok ini mau ngajarin matematika buat sbmptn. Whutttt 3 tahun??"
happy,Happy Birth Day Muhammad Yazid husain Ar Rozi #happybirthday #mybaby
fear,"Oh gini rasanya dipepet dan dikejar orang tengah malem gini. Lumayan bikin senam jantung. Kejar-kejaran ngebut bgt, mendadak aku pelan pas di bangjo dia nungguin dong sambil ngeliatin ke belakang mulu. Akunya nunggu lampu ijo, dia lurus aku mendadak sein kanan, amaaaaan :)))"
anger,"4. pas uda dikirim kembali, si kurir telp ngeluh dan mager buat nganter ke alamat yg bener. malah minta ketemuan di titik yg dia tau itupun dia gamau susah (no puter balik, hrs searah sama arah kendaraan dia jalan)"
happy,"Sahabat semua, terimakasih atas dukungannya untuk Fariz, putra Winarni. Dalam dua hari sdh terkumpul Rp 90 jt lebih. Fariz sengaja berfoto ganteng sore ini utk menyampaikan terimakasihnya. Ayo terus bersonasi lewat [USERNAME] [URL] [USERNAME] [URL]"
sadness,"@0281_bobotoh Lucu juga sih kalo menyalahkan cara berpakaiannya, setau uka si via vallen belum pernah pakai pakaian sexy yg memperlihatkan bentuk tubuhnya.."
anger,yang salah siapa masa yang ngalah harus saya !
happy,"Ngga disangka tersinggung! ak langsung di wa ""Hello""  tp ngga komen di status(dgn keadaan dia udah liat status ku) yaampun girang dong! karna sebenarnya aku selalu CAPER kalo bikin status di wa. Dgn harapan di komen. Puji Tuhan kali ini peka."
