label,tweet
happy,"[USERNAME] [USERNAME] [USERNAME] [USERNAME] [USERNAME] [USERNAME] [USERNAME] Duwet maut ibarat bintang sepak bola belgia hazard, lukaku.saling melengkapi dan melayani dlm mencapei kemenangan.."
sadness,salah saya apa ya hm-_-
fear,"Kondisi paling sulit itu,... Saat kita mendiaminya saja kita takut dimusuhinya, dan bila kita berkata-kata kita takut menyinggung perasaanya."
disgust,sejak kapan seragam pdh tni ad boleh sempit mrecet mrecet gitu ya aali gue jijik banget liatnya spt gigolo dasar jenderal kardus pecundang
happy,"karena aku merasa tidak ditanggapi dengan akun terkait, maka aku putuskan untuk report feed tersebut ke pihak Instagram. well, hari itu juga feed yang aku report dihapus pihak ig. im happy because Instagram concern about copyright issue"
happy,"Ngimpiin Dira sama almarhum bapaknya. Kita ngobrol bareng, ketawa-tawa bertiga sambil minum susu jahe di sebuah angkringan. Senengnya terasa sampe sekarang. Damai banget."
fear,"Pernah baca katanya emang ada oknuum yang bikin kebakaran. Terus kalau pemadam kebakarannya dateng, malah dihalang-halangin. Serem-serem ibukota serem... :(("
happy,Bahagia kalau kamu datang tepat waktu Bahagia kalau AC bekerja dengan maksimal Bahagia kalau perka berjalan normal Selamat bekerja ya min [USERNAME]
happy,"#SalamSaum Kita harus bangga [USERNAME] kembali meraih opini Wajar Tanpa Pengecualian (WTP) dr BPK thn 2017. Keberhasilan ini merupakan kerja keras kita smua utk mewujudkan Kementan yg bersih, berintegritas serta berpihak kpd petani &amp"
fear,"Terkaget dirinya saat tiba - tiba disapa seseorang. Takut, jika kau menyadari 'penyamaran'nya saat ini."
fear,"[USERNAME] Tp karena pengalamanku yg minim takut orang2 udah ga percaya duluan. Udah semester atas, trus pas oprec kan biasanya yg wawancara udah anak 2016, angkata bawah. Suka minder gt :( Waah ya udah sekalian mutualan yuu aku butuh positive people sep"
anger,Apa Hebatnya Mardani? Menurut sy oeang ini Cuma besar mulut aja Faktanya sampai saat ini blm menyebutkan Capres Lagipula kalau Koalisinya Hanya PKS dan GERINDRA nggak mungkin lah yaow
fear,"PANTES AJA SEMALEM PAS PULANG DAH BANYAK TNI DENGAN MUKA GERAM. Gue jadi takut2 gitu pas jalan, jalan cepet. nyampe kosan lgsg parno nutup semua pintu."
happy,Gatau asal muasalnya gimana. Tapi akhir2 ini orang2 yg ada di sekitar gw melontarkan komentar yang sangat senada dan selalu gw aminkan menjadi doa
anger,Hehehee kan memang itu yg di minta..seharusnya TBG Gentle kalau memang sdh tdk sejalan lg dgn [USERNAME] mengundurkan diri sbg pengurus maupun kader PD [URL]
disgust,aku paling jijik pas traveler bsa maafin shogun yg udh kejam bertahun tpi g bsa maafin scara yg hanya sbatas k
happy,"kalian pernah ngga sih ngerasain gmn rasanya telponan sm orang berjam-jam, videocall setiap malam, share with them padahal bukan siapa-siapa dan dia selalu meluangkan waktu buat nanya how was ur day sesibuk apapun dia."
disgust,bejauh anjir gausah stalking stalking jijik nya aku sat
fear,"{MU} guys aku mau ngecat rambut, tp sebelumnya aku blm pernah ngecat rambut, mau minta saran warnanya apa ya? Tp jangan yg heboh2 aku takut kaget"
disgust,btl lah dia tulis lgbtq ni semua berkaitan kebebasan nafsu apa yg manusia suka dia suka manusia sejenis e tp dia blh benci paedophile sumbang mahram dia pun x respect org lain punya nafsu minat padahal lgbtq ke paedophile ke sumbang mahram ke semua hina dan jijik
disgust,jijik sih edwin kurniawan lunggito maling kabur ke area jawa timur setelah mencuri uang dan emas di rumah keluarga kami di palangka raya
disgust,wow same tapi gua bukan takut sih lebih kek jijik aja
sadness,"Mbir, udah dibilangin kan, gada orang lain yang akan memperjuangkan hidupmu, selain dirimu sendiri. Jadi gausa berharap ya, biar ga kecewa :(("
disgust,keren kaga jijik iya
anger,"gimana ya caranya ngerubah instagram story viewers? kok toxic people bisa ada di urutan pertama -_- padahal buka ignya aja, saya gapernah -_-"
disgust,jijik emang anies penuh pembodohan n pembohongan
sadness,Tadi pas diajakin makan akunya emang lg eneg bgt. Pdhal buka puasa jg minum air putih doang tp perut eneg bgt:( giliran skrg aja laper bgt manusyaaa~
anger,tolong bantu saya [USERNAME] Kenapa ya lptop saya sudah 2 kali kok gabisa buka dokumen pasti not responding.pdhal sudah pernah dibawa ke hp center smg . Apakah lptop saya termasuk produk gagal atau gimana.beli 11 maret 2018 . Dan kalo gini trs kan jd jgkel sndri.
sadness,"Aku tidak meminta kau hadir dlm hdpku, tapi tuhan mempertemukan aku dan kamu. Aku tdk berharap lebih darimu, kau memberi harapan dlm hdpku hingga aku bs menerimamu. Tapi saat ini kau meninggalkan aku seorang diri tanpamu."
disgust,wkwkwk maaf tweet di atas agak jijik ye wak
happy,"Kita berteman beda genarasi. Asiknya kita yang tua berasa jadi muda, dan mereka yg muda belajar membahas hal-hal serius dalam masa depan. Kita berteman se asik #HonorIndonesia #Honor7S meskipun kadang harus mrnghadapi sifat kekanak-kanakan mereka. [URL]"
anger,[USERNAME] .... Kamu yg otak brengsek.... Dasar bodoh..... Di negara2 maju tol menjadi andalan utama..... Tidak ada negara maju yg tanpa tol..... Hanya Negara terkebelakang yg tdk punya tol....negara terkebelakang punya TOLol.... !!!
sadness,"Kehilangan lagi salah satu karyawan, dan tepat sebelum lebaran. Kembali lagi aku dipusingkan untuk mencari penggantinya, karena mencari karywan di pabrik tahu susah dibandingkan nyari orang untuk jd tukang parkir."
sadness,"Jika saya berkata sekarang, maka hanya ada cacian dan teriakan kasar ttg kemunafikan...utk itu skrg saya lebih memilih diam dan menjauh dari kehidupan."
happy,Setelah #RecehkanTwitter muncul #OldMoneyGakNgerasain nah sekarang lagi rame #AksiBelaVia ku merasa sangat uptudate dan bersyukur. Anti uninstall twitter twitter club.
fear,"udah gitu jurit malam umayan takut sih, soalnya tempat yg dipake kemah itu dulunya hutan. hanya skrg dijadikan taman khusus buat kemah gitu. setelah jurit malam jam 4 subuh itu harus nyari Lencana yg bentuknya sangat kecil. kayak uang koin"
disgust,sasuke tuh jijik ketempelan cewe cewe kecentilan alay cuma mau nyentuh dan disentuh sakura aja kadang gue sangat amat menyayangkan karna sakura ga pandang bulu ngobatin orang harusnya tuh sakura ga perlu ngobatin si karin yg udah dibunuh sasuke
sadness,Ini dia si pembuat sembab berpasang-pasang mata setelah melihat pertunjukkan boneka
fear,tapi ngeri sih ya emang akun gede dengan followers ribuan tuh kalo ngetweet yg jelek atau salah dikit yg hujat langsung banyak AKU TAKUT KALIAN UNFOLLOW AKU AJA PLEASE
happy,"Congratulations on your 1st Holly Communion, Xellent. Mommy,Papa, Ompung,Unty, Tulang, Bou, Uda &amp"
happy,"[USERNAME] Membelasut mesra, papa pirang, romeo rabun, serabi solo itu punyanya kak @/ronzzykevin wkwkwkkwkw membelasut mesra sih dulu rame wkwkwk"
sadness,"Kebodohan di bulan Ramadhan: jumat kemaren kejar2an waktu ganti2 bioskop demi film ini, ternyata masih kamingsun. what a smart smart day. [URL]"
sadness,"[USERNAME] Oh iya. BAY DE WEY: Jd sekalian nih: 1. Kl blm mapan JANGAN KAWIN 2. Kl mau idup enak, belajar manage duit yg bener Pesan ini disampaikan oleh pria 24th beranak 2. Brb, kill myself"
fear,"Eh tapi numbuhin brewok juga buat nyenengin diri sendiri sih, compliment dari sesama cowok bonus lah. Tapi ga dirawat dikit langsung tumbuh liar atau gatel banget"
anger,"Situ tau ga di Timur tengah sana, pakaian tertutup dari atas sampe bawah, tingkat Sexual Harassmentnya tinggi.. Tau ga?? Ini udah bukan soal terbuka atau tertutup pakaian, soal iman dan nafsu yang ga bisa kalian jaga, ga bisa kalia"
fear," berdesakan..bejubelan, di kRL adalah salah satu godaan dalam berpuasa.....apalagi d dpn nya ada wanita cantik sambil ngunyah tahu gejrot...hehe.."
fear,"Tiap kali George ketip2 minta minum, selalu keinget kejadian di Thailand ma [USERNAME]..kami pake motor sana (bentuknya mirip honda new supra) dan gatau ini mo diisi bensin macem mana, dan berapa duit seliternya  jgn2 kita ngisinya minyak tanah kan berabe ya.."
fear,"Pas Sma kalo pelajaran berikutnya bindo, ngibrit ke kelas bindo, cepet2an ngambil kursi paling belakang  gurunya serem wkwk [URL]"
happy,Alhamdulillah yaAllah.... -Terimakasih kepada kedua orang tua dan keluarga yang slalu mendukung dan slalu suport aku.. -Terimakasih juga kepada [USERNAME]
happy,[USERNAME] [USERNAME] Kalo kita punya tiket Tiket apa yang paling bisa buat orang bahagia.... Tiket ketemu @8rianna_ [USERNAME] #IniSahurTIKETCOMHariKe20 [USERNAME]
love,"Kata yang paling indah di bibir umat manusia adalah kata Ibu, dan panggilan yang paling indah adalah ibuku. Ini adalah kata yang penuh harapan dan cinta, kata manis dan baik yang keluar dari kedalaman hati. (Kahlil Gibran)"
disgust,aku emang ga liat mimik wajah kamu saat itu tapi aku punya rasa kamu jijik dan ternganggu banget saat itu dg keberadaan aku ya
anger,"Tunjukin barbuk dong kalau ASN itu bermasalah sehingga harus diganti. ""Sodorin klipingan koran"" Udah pantes disebut Gubernur Magang ?"
sadness,"Pacaran sama yg kerjanya sama2 sift itu jujur aja lumayan nga ena - Gue libur dia berangkat - Gue berangkat dia libur - Sama sama libur tapi abis sift malem capek Tapi, jadi buat tantangan sih kalo ngeliat orang pacaran dengan mudahnya jalan tiap hari alias bacot saya! Huhuhu"
sadness,Kenangan bersama Mamita [USERNAME] . . . . . . #AndreBaraBere #JuliaPerrez #JuliaPerez #Jupenizer #lll #lfl #tflers #likeforlike #sick #Jupe #Meninggal #RIP #RipJupe #Cecepy #Cirebon
disgust,final brawijaya all stars basket yang nunggu diluar kek bocah demen ngabisin duit ortu norak lu semua ajg jijik gw ngeliatin supo er tai ajg udah kalah sok nyari masalah o u lu noh kuliahin lu buat belajar bukan buat ikut kelompok tawuran najis
sadness,Aku rindu hujan. Di mana pertama kali kita bertemu setelah jarak yang memisahkan. Kemudian aku membenci hujan. Di mana saat itu kamu mengucap kata perpisahan.
anger,"[USERNAME] arti kata fans itu sama dengan mengagumi. sekedar kagum boleh, kagum demi kepentingan pribadi sampe menganggu kenyamanan orang, tidak."
sadness,"Cilacap,. Cinta lama gagal terucap Purbalingga,. Pura2 bahagia melihatmu berpaling dan ber keluarga Semarang,. Sedikit merindukan orang yang tersayang Saat ini di cilandak,. Cinta lama datang mendadak Dan makan sari roti,.. Saking rindunya merobek hati,... #ceritahariini."
disgust,ihh kak ita kita samaan ku juga jijikan apalagi wc kaya udh lumut kuningan serius jijik bangett apalagi jumpa yang suka nyimpen sampah beuh pengen tabok gitu seriuss
disgust,kalau di jilm k kadang aku kencing hehhe ngk jijik yah jilatinnya
anger,"Orang ga tau diri itu adalah kursi sebelahnya kosong tapi dibuat naruh jaket/tas, yang ga kebagian kursi berdiri di sebelahnya tapi dia tetep ga mindahin barang2nya :)"
disgust,jijik ama dirinya whuhaha
sadness,"Btw kemaren senin aing tolol banget lagi ngantri di starbucks, mbak2nya manggil ""atas nama kak roy"" aing ketawa seketika depan orangnya :( lain nanaon ieumah keinget Roy Kiyoshi"
happy,amin mokasih yo enak :) selamat ulang tahun da ade sukses selalu :D
sadness,"Kasihan karyawan bapakku ini, mau lebaran malah jatuh sakit dan masuk rumah. Dan sekarang mudik terlalu cepat ke kampung halaman. Gusti Allah kadang memberikan hal yang tidak terpikirkan oleh manusia. Sebagai manusia ya cuma bisa menerima."
happy,"Cringe sekali ya?! Hahaha. Cuman mau bilang, happy bisa kenal sama lu bro. Yaa walaupun kekuranganmu lebih banyak ketimbang kelebihanmu (Hahaha) Tapi aku sadar jika persahabatan ini tidak manis rasanya jika hanya menerima kelebihan saja :) [URL]"
disgust,jijik bukan iri
anger,Nggak ngerti lagi sama ciwi-ciwi yang nyinyirin Via Vallen ini. Dia itu korban loh. Sesusah itukah untuk saling support satu sama lain gurlzz?
happy,udaranya mendukung sangat buat makan abis itu tidur hoam :o
love,"Malah ketawa lagi, padahal sini yg buat sambil mewek. Tau sendiri kan, aing kalo udah sayang sama orang itu gimana. Walaupun cuma bisa sama bayang-bayangnya saja :) Lol"
sadness,"Waktu SD pernah dpt kesempatan seleksi untuk masuk tim kecamatan ke popda tingkat Kabupaten. Waktu ujicoba lawan kecamatan tetangga, saya cetak 2 gol, pertandingan berakhir 2-0. Saya ga lolos seleksi, yg lolos utk posisi striker anaknya guru"
anger,"Barulah disini dia keliatan nipunya , masa iya dia blg gini "" yaudah mbanya istri polisi kan? Sini cium, muah , (jijik bngt sumpah) . Kena bibirnya kan? Lagi sini. Muah"" Anjink -_-"
happy,"#PWBanget EMANG BEDA . . Viral curhatan Personal Assistant konglomerat Indonesia yg diposting di acoount twitter nya, asli baru kebuka deh pikiran kita tentang orang tajir yg ternyata ga sombong loh [URL]"
disgust,hal yang paling membuatmu jijik
love,"Sesederhana ini aku mencintaimu, serumit itu kau mencintaiku, hehe tak apa, yakin kita punya pikiran alternatif masing2 untuk tujuan yg sama! #justkidding"
fear,Hm. Kadang kalau analisis takut kebablasan halu karena aku lelah menduga duga soal soonhoon padahal mah aslinya bisa aja hanya imajinasiku
happy,inshallah kalo gua ada rejeki bisa foto bareng tom gua ga bakal kasih aturan ini itu ina inu ribet! gua post kesini bukan buat pamer tapi berbagi kebahagian jadi croplah komuk gua sesuka hati anda [URL]
sadness,"Langkah kaki datang dan pergi Kini tak ada lagi Sisa air mineral dalam botol Tak tersentuh lagi Bangku antrian yang kosong Tak berpenghuni Melihatmu datang dari ujung koridor Berjalan tegap dan cepat Mata mu bersinar senyummu berpendar Aku tahu kamu rindu, begitu pun aku!"
anger,"kurangin intensitas berkabar, jadi tak berkabar tiap hari, yakali tiap hari banget begadang cuman buat face time dan telponan, dikantor tidur. ""namanya juga perjuangan det"" ya engga gitu juga sih, bejuang ga sekonyol itu juga. ada saatnya lah~"
disgust,jijik nggak si ngurusin ciliwung aja gak becus mau jadi presiden ada juga ya yg mau punya presiden blo on
sadness,"Di cerita itu dikisahkan kalau istrinya gabisa ada keturunan, suaminya mau mempertahankan rumah tangganya, tapi si ibu laki2 maunya si anaknya itu menikah lagi supaya bisa ada keturunan. Dan si istri sudah lapang dada untuk pisah,namun si laki2 kekeh untuk mempertahankan istrinya"
disgust,halahh meleleh mililih jihit yg udh jg di kamp alkhol syria pada minta balik disuguhin perang depan mata jijik gw
fear,sedihnya tuh ketika sedang seperti ini ga ada 'tempat sampah' jadinya nyampah aja di twitter maaf ya followerku :( btw aku bingung deh tadi nimbang 43.6 trus pup 2x abis itu turun lagi jadi 42 ini timbangannya yg labil apa gimana????
sadness,sekarang mah belum bisa nyengir masih stay sama emot itu memang kenapa sih kalau suatu sat us kaya tidak-happy begitu suatu sat saya bahagia :(
anger,"dan yang terjadi adalah seseorang membalas wa status ku begini ""bang, kenapa diklaim sampe kekgitu, kan cuma foto"" Cuma foto dek? balasku begitu ! walaupun cuma ""foto"" itu juga hakcipta aku kembali bertanya seandainya karyamu digunakan orang lain tanpa izin perasaanmu bagaimana?"
happy,"[USERNAME] Pilih pemimpin yg happy mnerima kritikan,jujur terbuka,sll bermusyawarah,tdk hobby menyerang serta berjiwa besar maka proses mbangun peradaban guna pencapaian terbaik sebuah negara akan mdptkan hasil maksimal...In Shaa'Allah..."
sadness,"Masih galau jg sih tp solusi utama ku sih bikin target & rencana, mau ngapain aja di umur sekian. Trus fokus pada usaha utk mencapai itu, biar ga terus kepikiran problem quarter life crisis"
love,"Indahnya jatuh cinta itu saat orang yg kita suka, Waktu kita tengok dia sambil tersenyum, Dia juga tersenyum balik kat kita"
love,"Sambutlah cintaku duhai sayang, Cinta kita untuk selamanya, Biarku sentuh hatimu ini sendiri, Selamat malam wanita terakhir, Tak mungkinku kan temu seindah ini, sampai bila ku harus menanti untuk kau menjadi milik ku"
anger,"[USERNAME] [USERNAME] Mending ngusut masalah teroris demi pertahanan dan perdamaian NKRI. Etdah Pak, gausa bawa2 aparat hukum buat kepentingan politik situ napa. Btw sesekali nunjukin komentar yg pantes sbg alumni UI Pak. Biar gak dipertanyakan khalayak"
love,"Pada saat kamu menangis merengek meminta boneka atau mainan baru, mama menatapmu iba. Tetapi papa akan mengatakan dengan tegas : ""boleh, kita beli nanti, tapi tidak sekarang"""
fear,[USERNAME] Wah bagus deh itu yg mau duet juga yg udah legend. Btw mereka ada ngomong mau dueg itu dimana dan kapan? Iya sih......cuma takut suara dia jadi rusak/berubah gitu karena salah teknik
happy,"bangun tidur dapet kabar temen diterima kerja aja aku sujud syukur seneng banget. gatau lebay atau apa yak :((( bep, nyari kerja itu, iya, sesusah itu :((( imma proud friend "
anger,"Seharusnya yg harus marah itu JKT58 (yg milih), klo ngerasa memang ada kemunduran ya lu olang wajar ngomel. Mungkin JKT42 marah2 juga bisa jadi karena ada rasa sayang. Eh gimana ditinggal disaat masih sayang2nya gitukan(?)"
sadness,"Sering terjadi ! Puasa bukannya badan makin kurusan malah makin lebar dan klimaksnya pas hari raya banyak yang tanya ""Sekarang gemukan ya"""
love,Nge gua cinta sama lo ngelebihin cinta githa sama lo. Love you nge. Temen gua yg bisa dampingin gua sampai saat ini. Curhatan gua sampai saat ini. Walaupun no solution. Hati gua senyum klo lo yg ngomong.
happy,[USERNAME] #puisimalam apapun alasannya hanya TUHAN yang tau ... semoga kelak akan menerima balasan atas perbuatan nya masing2 .... kita hanya bisa mendoakan supaya tidak terjadi lagi ... Amin ttd Admin Sore
happy,Positif thinking aja..susu kental manis ga ada susu nya..besok2 pasti ada koq susunya..sama ky 2019ganti presiden..skrg blom ada presidennya kan?
sadness,"[USERNAME] [USERNAME] [USERNAME] Begitulah mereka. . . Benar kata pepatah ""kemarau setahun dihapus hujan sehari"" Miris sekali negeri ini. . . Sebegitunya demi kepentingan tertentu. . ."
sadness,haaaa syabar ajaaa... beloman waktunya buat ikutttt... pemerintah ajanihhh yg ketumbenan ngasih liburnya kepanjangaaannnnnn :((((
sadness,"Yang berat itu bukan rindu, dilan. Tapi ngerjain skripsi dengan berbagai pengalaman psikologi yang kurang baik. Katanya ada yang bilang tema dan judul yang saya ambil, sangat cocok dengan pengalaman pribadi saya. Bisa dikatakan iya juga bisa tidak sih."
disgust,platform ga sadis cuman jijik bgt apalagi klo nontonnya pas lagi makan beuh
disgust,gaada yg bilang serem cuma jijik aja
happy,"Mau Ngucapin Happy Birthday yg ke 24 buat de' Nursehah. smoga berkah umur & rezekinya, sehat slalu, makin rajin ibadahnya & tetap jadi wanita kuat yg menginspirasi bnyak org. Wish u all the best girl  #IniSahurTIKETCOMHariKe20 [USERNAME] [USERNAME] [URL]"
sadness,"Oiya ketinggalan, sosis telur. Jauh2 ke pasar wadai, nyampe sana eh sdh habis. Besoknya balik lagi. Sama pengen bakso isi super pedas juga kehabisan, yg ini belum kesampaian"
anger,"Jangan pilih Jokowi, atau golput aja sekalian, nanti Pancasila yg menjadi dasar negara kita sekarang akan ikutan terganti.. Mau?? Mmmmmoh!!!"
disgust,kalo udah jijik bgt sama orangnya mau ngerjain apapun yg disuruh itu bawaannya gak ikhlas trus sering nunda
anger,"Walopun sakit hati, tp gw tahan utk ga nyerang balik dg makian. Pantang gw ngomong frontal. Sebisa mungkin gw tahan. Dan ngeblokir adalah solusi yg sangat2 TEPAT!"
anger,mimpin Jadi Bupati Tasik aja Gak bisa apalagi jadi Gubernur aduh kang tuh di Kabupaten Tasik Oge PR akang masih Banyak malahan Masyarakat tidap puas dengan kinerja akang sekarang pengen jadi Gubernur ??? Cing atuh MikiL
fear,Cerita dengan A lain. Cerita dengan B lain. Cerita dgn C lain. Aku harap hubungan suami isteri tu halal lah lagi. Huhu jgn di bawa main tau cerai2 ni. Bahaya
anger,"Ya Allaaaahhh ketika kamu kesel akan sesuatu, ingin marah, tapi nggak ada gunanya karna lain pihak sulit kerja sama. Makan twit ini beserta komen netijen bikin lupa semuanya. Ikhlas aing ikhlaaaassss"
love,"Oppa nihhh aku ada flower bucket buat qm ,maafin aku udh bikin km ngambek krn gk ngabarin tadi, akuu sayang kamuuu"
anger,"[USERNAME] Karena mereka memegang peraturan, yang kebanyakan nasabah tidak mengetahuinya. Kesel sih. Dulu pernah gagal klaim asuransi AXA Mandiri 2x juga gara-gara ada klausul yang menurut saya sedikit aneh."
sadness,"Tertawa diatas kebodohannya itu luar biasa. Gak malu sama sekali dan mungkin urat malunya sudah putus. Sedangkan kita pasti mikirnya ""duh, malah ketawa bukannya mikir "
happy,"Mak gregah! Lantas saya bangkit dari tempat duduk. Mematikan saluran wi-fi, dan membayar kopi. Saya tinggalkan Kajen. Beralih ke masjid Si Mbah Ronggo Kusumo, Ngemplak Kidul yang ada di belakang rumah saya. Ikut kawan, nabuh beduk."
anger,"Sesama cewe lho (kayaknya), harusnya bisa lebih rasain lah yang harus sibuk jaga diri, rasain sakitnya haid, dan paniknya pulang malem sendirian. Gimana orang asing? Wajarlah banyak korban yang takut curhat, bukan dibela malah dihujat."
happy,Bukber pertama dgn org tersayang...  [USERNAME] [USERNAME] [USERNAME] [USERNAME] syngx kurang [USERNAME] dan [USERNAME]
disgust,gue ngalaminnya di telapak tangan sama sisi kanan kiri jari jari dan bbrp minggu kemarin tu lg parah parahnya bgt yg gatelnya bgt bgt sampe kdg jijik ngeliat tangan sendiri tp alhamdulillah skrg sudah membaik cuma ya gitu kayak gini tu emg suka ilang muncul huf stress emg
fear,Baca cerita [USERNAME] ini emang kacau. Niat baca biar tidur malah jadi parno gabisa tidur.
love,"sayang lo selalu karna gga dda yg bsa gantiin lo walaupun lo bkan milik gw lgi gw kan tetep sayang sama lo ,, gw lebih sayang sma lo dibandingin rsa sayang gw ke cowo gw"
disgust,gue kenapa geli mulu ya liat orang bridal shower terus mukanya digambar d ck kayak apa ya jijik aja
anger,"Pemimpin mendidik RT jd tukang minta2x alias ngemis ya pak ..  Kalau minta ke warganya sendiri nggak apa2x krn warga memang punya tukang sampah gitu lho pa KEWAJIBAN, uang dikumpulkan warga utk bayar THR petugas keamanan"
sadness,"Padahal dah tau sendiri tadi bangun tidur tumbang lagi gara2 semalem bukber isinya es semua. Eh barusan belajar di luar, yg diminum tetep es dong. Hani memang"
disgust,jijik tau
disgust,hal kecil saja ga bisa atasi anjing kami jijik
happy,"Iqra' = bacalah.. Bacalah walau hnya satu kalimat.. siapa tau asik.. eh malah jadi separagraf... Tau"" keasikan udah satu bab.. dan akhirnya satu buku... [URL]"
disgust,jijik bangat liat kelakuan mbak mbak kampungan gitu bikin malu di kira mereka senang liat lu kayak gitu muka lo terpampang jelas ya
fear,Dilemma ku adalah jam segini ngerasa laper dan pgn go food naspad duta minang jaya yg super enak itu tp takut gabisa tidur dan kesiangan bsk pagi huu
anger,"Karena kalimat ""masasih uang yg kmrn dksh gacukup"" - ""boros bangetsih, masa uangnya tinggal segini"" lantas si pengatur keuanganpun ingin murka rasanya :')"
sadness,"Sedari tadi idung meler trs wkt terawih, tenggorokan rasanya sakit. Yaps setelah memakan ini jd mencair semuanya hehehe [URL]"
anger,"Heran dengan RKHUP ngawur. Keknya yg merancang ngawur juga deh. Sampe-sampe tdk mempertimbangkan dan melibatkan pihak lain. Elo-elo anggota perancang, jgn sesuka hati membuat RKUHP utk mnguntungkan drimu sendiri. Heran, masih betah aja makan gaji haram gitu."
disgust,ihh gue pernah nonton film psikopat thailand gtu tapi lupa judul jijik si sumpahh pdhl gue sering nonton yng genre psikopat
love,"Dalam cinta, ketika ada yang berbeda, jangan mencari siapa yang salah, karena kamu dan dia adalah tim yang sama dengan tujuan yang sama. #FRN"
sadness,"Jujur saja saya sedang mengalami kejenuhan di zona yang sekarang. Mulai jenuh dengan keseharian, orang2 yg cuman itu2 aja, obrolan yg itu2 aja, dan semua yang itu-itu aja."
love,Hal yg aku suka dari ayah itu salah satunya adalah kesetiaannya dimana mampu buktiin kalo cinta cukup 1 untuk seumur hidup. Berani ngelakuin apapun yg pntg bisa hidup bersama sang pujaan hati sampai mati.
disgust,ngeliat orang general sekarang udah jijik
love,"Saya taKan raguKan besarNya kasih sayang Tuhan yg telah diberiKanNya kepada saya,walau momen sulit yg harus saya hadapi dalam hidup ini. Karna saat cahaya dalam hati kita mulai redup,hanya kasih Sayang dari mereka yg mencintai kita, yg mampu menjadi lentera tuk menerangiNya kembali"
love,"Cuma ibu yang tahan sujud lamaaaaa sekali untuk mengudarakan doa. Cuma ibu yg setiap malam ga absen bangun malam untuk menggantungkan harapan padaNya. Cuma ibu yg rajin puasa menahan nafsu agar supaya Allah sayang. Manis ya. Sayang sekali, ibu"
sadness,"Gak jadi include kemang karna yg dp gak jelas php doang,tp besok fix include blokm masih ada 2slot kosong [USERNAME] [USERNAME] [USERNAME] [USERNAME]"
sadness,"Ekspektasi Emak : makanya kamu jangan capek-capek jadi sakit kan main mulu sih Realita : sokorr ,salah mu dewe dolan ae ,domongi kon nek omah ae ange eram #recehkantwiter"
disgust,nah biasanya begitu hati dg apa yg engkau lakukan bisa berbalik semua allah yg akan membolak mbalikan itu semua itu sdh level yg jijik banget gak sopan amat apa susahnya jawab nggak kan beres gak prerlu main ludah ini yg tambah buat bahan nyerang arman
sadness,Innalillahi wa inna ilaihi raji'un. Mohon doanya temen2. Ayahnya [USERNAME] barusan aja meninggal. Semoga diampuni segala dosa2nya dan keluarganya di beri keikhlasan dan kekuatan. Aamiin Yaa Rabbalallaamiin.
fear,"[USERNAME] Wkwkwk laah aku yg masi menata hati dan menata diri stlh menjombs, & uda nyaman jombs, malah dikenalin ama masnya, ku merasa blm pantas & takut pelarian lg, entah pelarianku yg masi blm moveon dari mantan (cowo idamanku), entah pelaria"
disgust,jijik bgt mana usn nya kek jadi si paling ot tp dr kata tweet dia seolah dia setuju klo emg hj dulu ngbvlly dan minta maaf gila gila emosi bgt sumpah
sadness,"[USERNAME] [USERNAME] salah satunya krna terutama pejabat negeri ini suka mencari cari kesalahan / kelemahan pejabat lainnya, bukan sama sama cari solusi bgmn bangsa ini bisa maju dan berkarya.."
anger,klo milih pemimpin bukan petahana nanti jadinya gub tidak tahu & males kerja spt ini  [URL]
