label,tweet
sadness,"Terlalu banyak moment pencitraan di postingan ig nih. Pengen ngapus tapi udah ke posting. Yaudah deh biarin aja ya, sekarang berusaha agar tidak terjadi hal seperti itu lagi saja"
anger,ini udah masuk ke proses penjualan... Tapi pas dibuka detail ko malah gini? Apakah produk sedang diproses atau diproses tgl 11?
happy,Sesungguhnya org yg gugur di jalan-KU tidak lah mati... mereka hidup (bahkan selalu hidup) dan mendapatkan rejeki.... Kau selalu hidup dlm peradaban &amp
disgust,sumpahh gw jijik ada org bikin au bxb tpi disangkut pautkan sama agama kek anjirt gw beneran jijik anjirr yak walau gw sering baca au bxb tpi klo au nya yg begini gw bakal skipp jpz
disgust,se jijik itu kab connect aku pgn nonton tp ragu
anger,"Beuh KRL JKT -CIKARANG mah jangan ditanya lagi penuhnya. Sesak bro Petugas kemana? Penuh sesak gitumah ga bisa jalan kesana-kemari atuh petugasnya lapor gimana? Klo da pelecehan hajar ja ditempat ja pelakunya, biikin rame dulu."
sadness,Bagi rapot itu batin haha misalnya nih indikator kepercayaan diri teman kecil perlu dibimbing lebih baik lagi. Di satu sisi ini jadi pengingat dan cambukan kalo aku pun krisis kepercayaan diri hehe
sadness,Ini Juni Dimana gugur daun bidara melunglai.. Meresapkan sepi Hanya sesak rindu menggebu Disemua lembar lembar kekaguman Aku pada mu Sudah Lelah kah kau menatap? Sementara langit masih menyimpan cahaya.. Biarkan malam memeluk gelap Pagi memuja sunyi Dan Aku mencinta engkau
sadness,Anehnya dimulut sama sekali gak kepedesan. Tapi abis itu langsung sakit perut. Semaleman bener2 sakit perutnya. Hari ini udah bolak balik ke toilet. Biasanya makan pedes kayak gimana juga gak sampe segininya. Apa yang salah???
sadness,Ketika di group keluarga udah pada ngomongin mudik. Duuh pengen mudik. Tapi apa daya suami libur cuma 4 hari dr hari H lebaran. Itu juga kalo g di telpon disuruh masuk. 2 tahun lalu malah habis sholat eid lgsg kerja 
happy,"asal lo tau aja, org kurus&kecil itu sebenarnya makannya banyak, tp g gede gt lhoo:') dan sebaliknya org gendut :') mkn dikit tp gendut:') jangan minder jd org kurus&gemuk!! bersyukur aja sm ALLAH"
sadness,"Wah pagi ini sangat faedah. Udah gaboleh sering ngeluh sendiri kalau ada perihal apapun mengenai perjalanan kereta:""3 sebegitunya mereka kerja keras, sedih akutuh"
happy,cihe zayn malik alay selamat ya wkwk iya pi memang jadi kaya anak punk (cont)
sadness,"[Askmf] coba deh sekali aja lu jd gue, ngrasain jatuh cinta diem diem, lu perhatian ke gue dan gue senengnya diem diem, tiba tiba dapet kabar lu jadian ama cewe lain juga gue diem. Diem diem sakit ndiri."
disgust,selamat hari anti rasuah sedunia rasuah adalah suatu perbuatan yang terkutuk dan jijik amat dilarang dalam islam ma
disgust,parahh jijik bat anjgg hahahaha bodo amatt ttp aja gw pakee i love my self cause anyone love my self xixixixi
anger,Adek kosan pinjem tupperware w (yg sebenernya akan w bawa pulang kamis ini). Sama dese diisi rendang trus dimasukin freezer. She just sent me to hell
anger,"Jenis orang yang bikin males dari awal ketemu adalah yang seneng banget nyombongin diri sendiri. Ya mungkin sebenarnya karena dia nggak pede ya, jadi butuh pengakuan. Tapi males banget nggak sih ngobrol sama orang kek gini, meski pun dia cantik/ganteng banget?"
anger,"[USERNAME] Nyampe kampus mau daftar ujian aika, ternyata ga bawa persyaratan sertif, daaan ga bisa daftar, oke lgsg ke bank buat bayaran, nyampe bank 14:46 pak satpam bilang maaf mba udah tutup, asdfgjkl."
sadness,"Sedih bny penulisan resep yg tidak baku sdm, sdt, ruas, sejumput, secukupnya, even biji/buah termasuk tidak baku :("
sadness,"Wkwk yasama halnya kan, kayak menyelipkan pesan dalam tangisan tu lebih ngena drpd dalam bentuk gelak tawa. Jadi kapanpun kamu kepikiran ya kenapa engga dituliskan aja gitu -sampekengtay dalang , dialog terakhir yang tak sempat terukir did"
sadness,kapan ea masalah nya cepat klar
happy,Mbak [USERNAME] warbiyasak nih emang nih threadnya. Aku sebagai perempuan baca thread kamu itu cuma bisa berdoa aja. Semoga kamu nggak pernah ngerasain yang namanya pelecehan sexual ya.
love,"Kasih sayang yang ibu berikan bukanlah harta yang melimpah, bukan pula rumah yang mewah, namun hanya doa tulus dari hati agar senyummu tetap merona sepanjang hidup yang kau jalani, Nak... [URL]"
anger,"[USERNAME] Jangankan #TGB, jika #HRS atau #SBY bahkan #PmarahanArab sekalipun, kalau merapat ke [USERNAME], gak akan saya dengar seruannya. Indonesia butuh pemimpin kredibel dan Jokowi tak kredibel... #AkuGppKok"
anger,"Make sure sebelum ngatain orang lain jelek, you lebih kece. Make sure sebelum ngatain orang lain tolol, you lebih cerdas. Make sure sebelum ngatain orang lain drama, you bukan orang yang baperan."
fear,"Jujur gue takut banget mau ngejalanin ini lagi, semakin dekat, smkin takut mau nangis aja rasanya, gak tau knpa setakut ini, kek bertanya2 mulu gue bisa gak ya jalaninnya, gue mampu gak yaa, apa gue mundur aja, apa ini jalan yg terbaik buat gue"
happy,Hiburan di hape klo ga lihat #recehkantwitter ya minta google assistant buat ngirimin joke macem ini. Hidupku memang kek uang kembalian. [URL]
love,"Habis diem, cemberut, rewel.... Lihat tante jalan dari luar mau masuk rumah udah senyum"", mulai ceria, nempel terus di tinggal bentar nyariin nte putput... Tante pulang diem lagi, nangis nyari nte putput.... Kangen bngt ya dek"
disgust,jijik dgn diri sendiri
love,"[USERNAME] well, prince charles bilang waktu george pertama kali lahir dia seneng banget dan berusaha menjadi kakek yg baik soalnya dulu ngerasa kurang ngejaga william. beliau juga sering ngajak george buat menanam bareng gitu, pokoknya sayang banget d"
fear,"Eh barusan temen w satunya cerita katanya do'i minjem duit janji hari ini. Tapi kaga dibayar, pas ditagih via whatsapp nggak bisa dihubungin. Didatengin marah marah. Kan serem huhu"
fear,"Bodoamat deh kuping gue paginya budeg juga, kejadian horor tadi siang masih tak terlupakan. Gue ga bisa gak denger suara. Takut. Jadi tidur sambil dengerin lagu"
happy,Kita yg tak punya apa apa dan tak seberapa ini disapa sobat misquen asik asik aja malah nyala balek damai segampang itu yah hebat uiy
happy,"Alhamdulillah segala puji bagi Allah Tuhan semesta alam, terimakasih masih di beri nikmat sehat,rezeki,umur panjang. #happy25 #thanksfam #thanksdear"
disgust,maho yg ini numpang beken caper yg jijik mungkin hatter as klo hatter mau gmn jg tetep jijik mak asli gedeg gw liat amphibi itu
sadness,"Entah sampai kapan gue bisa pergi jalan tanpa ada perbebatan dulu. Ya gini emg anak sulung, mau pergi aja ga dibolehin gegara adek nangis kejer dan pengen ikut. Nempel mulu udh kek perangko hm:"""
anger,ANJIR YANG DI ASKMF. mau marah tp mau scroll lagi aja takut. kampret. I'm trying to sleep right here dkskdf mulai kebayang kan skrg. babihutan.
fear,"Perkembangn khidupn mmg sungguh dahsyat, itu smua akibat dr hal yg dirasakn.. Di sisi lain ada pula yg memilih tdk beragama hanya dg mengedepankn nilai2 dasar kemanusiaan/kberadabn [URL]"
sadness,"Yang saya lakukan ketika mikir keras : 1. Mantengin leptop berharap dapat ide. Buntu. 2. Nyetel musik berharap merilekskan otak, biar ada inspirasi. Buntu. 3. Glibag-glibug di kasur, merenung sambil meluk bantal. Kemudian ketiduran."
disgust,dia tersenyum tapi kek jijik gitu pas liatnya
disgust,idih jijik
sadness,Aku tidak mampu... Mencegah hatiku untuk tidak terus merindukanmu.. Meski aku sadar bahwa rasa rindu ini hanya akan membuatku bertambah sakit.
happy,"Bagaimana mungkin sebuah pondok pesantren dapat hidup dengan aman dan nyaman di tengah masyarakat yang mayoritas penduduknya penganut agama Hindu? Ini semua telah mendorong sinergi alami antara agama, toleransi, dan demokrasi di Indonesia,"" kata dia. #Jokowi2Periode"
fear,"Maaf prof, bukan cuman takut ditelanjangi, jauhi korupsi kerna ITU DOSA, bagi yg masih punya iman takutlah kepada Allah Yang Maha Mengetahui...."
happy,"Selepas Munas KAHMI kemarin kami PKMD [USERNAME] sempat menikmati Kopi Kok Tong, mantab rasanya Kanda. Sehat dan sukses terus kanda.. Barakallah [URL]"
disgust,kesel ka smape jijik banget aku baca statement dia gtu
fear,"Gue tadi di sekolah kucek kucek mata kan ya. Abis itu banyak bulu mata yang rontok. Auto panik nih, takut kalo gundul sebelah. Nah, bulu mata tuh bisa tumbuh lagi gak sih?:("
disgust,gw lihat nya aga jijik gtau
disgust,jijik banget anj
sadness,"siang tadi merasa bodoh pengen ke sebuah Cafe yang mana tempatnya sehari-hari gue lewatin klo mau pulang sore pun begitu pengen ke museum macan, kirain mah jauh. selemparan kolor dari kantor dan kostan pacar. hahaha ku merasa dodonk."
anger,"please min [USERNAME] jaringan wifi telkom kok lemot sekali. Padahal masih serumah cuma beda lantai aja atas sama bawah, kenapa signalnya ngilang2 mulu"
love,[USERNAME] Naomi..Aku benar-benar Sayang dan Cinta sm kamu.. Aku mohon Terimalah Cintaku Yg Tulus dr Hati Yg Tedalam.. Aku Mencintai Kamu.. [URL]
happy,"Hahaha..... Lha die gak ngomong2 juga tuh, saat orang minta foto karena ragu dia manusia apa patung aku sempet punya niat pencet hidungnya hahaha.... Tapi ketinggian."
fear,"Takut banget sama kecoa. Amit amit tuh makhluk harus musnah dari bumi /woi satu sva pun tau saya takut kecoa heran 3') Saya gen 19 moroi, pernah jadi press moroi. Orang bilang saya nista orang bilang saya bullyable sampe pas kas hov di lempar ke atas"
fear,"[USERNAME] [USERNAME] [USERNAME] Tidak disemua tempat kita boleh melaksanakan sholat, salah satunya di bangunan yang didirikan untuk kekafiran (salah satunya gereja). Aku berlindung kepada ALLAAH SWT. dari godaan setan yang terkutuk. https"
love,"11. awal pertemuan sama si mantan itu pas wgl. pertamanya gamau lanjut, aku udah bikin tweetnya bilang makasi dll tapi kayaknya dia ga ngerti. Jadinya dia nempel terus ke aku, yaudah deh akunya juga jadi demen trus jadian"
love,"Kesabaran mu menghadapi ku yg membuat ku bertahan, perhatian mu yg membuat ku bertahan sayang mu pada ku pulang yg membuat mu bertahan,Keyakinan mu menjaga ku lah yg membuat ku bertahan... trimakasih sayang smoga bs lewati semua #LDRkronis"
sadness,"Semoga pa [USERNAME] Sadar Bupati Purbalingga dari PDIP Kena OTT KPK, Warganet: Allah sedang menunjukan Pak Mahfud partai mana yang lahirkan koruptor besar.. [URL]"
fear,[askmf] guys temenku ada yg nyilet tangannya sendiri. Aku takut dia lg depresi atau semacamnya. Aku sebagai temennya hrs gimana ya. Tapi kita beda kota skrg. Apa aku kasih tau ortunya? Tapi gaenak juga huhu
disgust,jijik ngga sik
disgust,pdhal akun itu setiap ada yg membullyku sllu nongol bhkn mengatakan jijik ke aku apakah dia sesuci itu
sadness,"Ya Allah udah 2 hari ini lasut. Kemarin bangun jam 10 padahal kerja jam 9. Hari ini ingetnya kereta jam 11, taunya 8.45. Ya Allah ,, semoga aku ga lasut jg hari H"
sadness,Portugal rasanya akan jadi yang paling lemah diantara 8 tim kandidat lain. Modal mereka juara EURO 2018 cuma HOKI!!! + catatan Ronaldo di Piala Dunia buruk. Paling mentok di 16 atau 8 besar.
anger,bicara asal ngejiplak saja sok tahu sangat sih  (at sos wisma slipi lt 7)
happy,"Dia 30 tahun, dengan status kerjaan padat. Aku padahal udah mau 27(selo banget) cara ku biar di wa itu konyol abis sih HAHA. Tp it works, so"
happy,"[Habis buka Facebook] [Thinking..] Sebanyak itu ya teman-teman yang saya kenal, mulai dari teman SD, sampe pas jaman kuliah, dengan segala kesibukan mereka sekarang. Seneng aja lihatnya, feeling very grateful have a live in this life. Alhamdulillah."
sadness,"Nah gue ktmu org yg negatif, dia bawaannya pesimis mulu. Kita pny ide bagus, blm aja dijalanin, dia udh matahin ddpn. Tp di socmed dia, seakan2 dy udh ngerjain prestasi sgla2nya"
disgust,km gk bleh gamon jijik
disgust,aku yang undi ph ni pun menyesal semua benda kalau boleh dia nak putar aku dah nmpak semua benda dia kelentong rasa jijik pulak undi ph hmm
happy,"usaha yg baik tidak akan mengkhianati hasil. kalau udah berusaha yg terbaik, tapi hasilnya sedikit mengecewakan.. rasanya itu, hati lebih lega dan lebih mudah buat ikhlas. ya paling tidak, sudah berusaha jadi yg terbaik."
fear,"masih ditemukan harimau jawa di kampung halaman saya (saksi terpercaya) dengan semakin menurunnya jumlah makanan (kijang yg banyak diburu, juga kepemilikan senapan, saya kuatir lambat laun akan bergesekan dengan manusia [USERNAME] [USERNAME]"
fear,"Berat badanku 77kg, aku minder, aku takut di bully, aku takut mereka yg bilang cantik itu langsing bukan C A N T I K Aku juga takut dibilang ""Gapura Kecamatan"" #janganbullyaku [URL]"
anger,"somplak ya kak hahaha, pengen tak unjukin sama orang kantor yang berusaha yakinkan aku soal flat earth inihhh... BACA ALON ALON ya mas"
happy,"Alhamdulillah ya, anak sultan ini sidang. Terharu saya :"") (@ Fakultas Hukum in Depok, Jawa Barat w/ [USERNAME]) "
happy,Terima kasih temen2 HMJ D3 Keperawatan Stikes Al Irsyad Cilacap sudah berbagi kebahagiaan bersama mbah kakung dan mbah putri [USERNAME] [URL]
sadness,"Sebenernya gak pengen ikut-ikutan jadi panitia pemilu, tapi gimana yah ada duitnya sih. Lol Gak juga deng! Hmm lebih ke pengen ngerasain gimana jadi panitia pemilu gitu. Dan baru tau kabar soal kecurangan kotak suara itu benar adanya. Sungguhlah manusia2 ini"
disgust,jijik gausah sok deket sm shaheer jadi cewek kok genit banget sih murahan
happy,"[USERNAME] [USERNAME] [USERNAME] Terima kasih sudah tertawa semoga menjadi amal soleh dibulan mulia, bisa membuat sesama hambaNya ketawa bahagia"
happy,lagi beli mrtabak gliran sudah jadi tapi kaki berat melangkah gra2 dengar lagu hayah mas mas nya lf juga kaya nya :p
disgust,capek kan jijik kan lo liat lo sendiri yang abis nangis mata dah sipit muka bengkak nggak malu lo gitu berkali kali lo bilang kalo nangis tu nggak bakal nyelesain masalah kenapa masih nangis hahnangis tu yang kelurin cuma air mata bukan emas yang bisa lo jual
happy,"Yakin, bahwa semua yang kita amalkan kita berikan sama orang lain (sedekah) akan ada gantinya. Bismillah, ikhlas.. semua yang disimpan terlalu lama tidak baik, bagi sedikit hartamu untuk orang yang membutuhkan. Karena hidup bukan melulu tentang harta."
fear,"pagi ini nonton berita headline nya bikin takut mulai dari 'Suami bunuh istri' , 'Kakek perkosa cucu' , 'Ayam bakar solo' . ngeri banget nih berita"
anger,"Haha kasihan juga kpd akun ini.Belum sembuh juga sakit dendamnya.Sepnjang hari,kerjanya usilin Anies.Dikiranya Anies aware.EGP.Pdhl konco2nya sdh bnyk yg insaf.Yg ini,belum.Tunggu struk. [URL]"
happy,"Semoga lancar, selamat Pesantrenku Menuju Usia 1 Abad. Usia dimana dilahirkanya Para Pembaharu-pembaharu dibidangnya. Dan Semoga Pesantrenku menjadi salah satunya"
disgust,main rumah rumahan tp aku nikahnya ama burger karna aku gamau nikah ama cowo pas umur thn karna cowo cowo is jijik huek
fear,"Logika nya, ketika rumahmu diminta untuk menampung orang yang belum kamu kenal selama 40 hari apa gak takut dan tidak nyaman? Kalo saya sih takut dan tidak nyaman walaupun ada surat rekomendasi..."
sadness,"Kita hanya sedang mengalami masa masa sulit, masa masa gelap, masa masa rentan akan perpisahan. Namun, jika kita mampu bertahan, maka tidak akan yg mampu memisahkan. (Except Allah)"
love,Tetap disini.. Jangan biarkan aku sepi sendiri.. Izinkan aku selalu bersamamu.. Dalam ikatan yg direstui semesta.. Aku sayang kamu separuh hatiku
disgust,kita bukan nya takut kita jijik sama sepupu dajjal
sadness,"Kukira kita bisa berteman, lebih jauh bersahabat, tapi ternyata tidak Sepertinya dari pihakku saja yang berusaha Ah sudahlah, pencemburu sepertiku berhak apa"
love,"Namanya juga udah sayang, mau disakitin kaya gimana juga tetep aja maafin. :')"
happy,"Laptop udh 6 tahun, jam awet ampe 3 thun br bterai mati, sepatu awet ampe 2/3 thun, tp gk smpe rusak kdg udh beli, suka addict klu sm sepatu."
disgust,njir ternyata dia mutual gue anjrot auto unfoll jijik soalnya
love,"makin lama kenal, a makin suka dengan lelaki ini. makin lama makin sayang, sampailah last sekali si a ini bercinta dengan lelaki itu. lelaki itu pun baik (according to a) seorang lelaki yang penyayang, soft spoken memang taste a lah."
happy,"Sekarang qu mengerti, dulu waktu kuliah dipaksa lembur begadang demi tugas itu semata2 buat nyiapin elu lembur begadang kek quda demi kerjaan kelar on time. Ok, lesson learned honey"
love,Jatuh cinta tidak mengenal tipe Kau takkan peduli fisik dan isi kepalanya Yang kau tahu hanyalah: Jantungmu berdebar kencang bila berada di dekatnya
fear,"Kemaren, pembagian nilai uts. Takut bener gue ga bisa imbangin pas uas. Kampus gue serem."
disgust,jijik akutuh
disgust,lah elu kenapa anj  mbakk sehat apa jangan jangan elu juga sakit ya sakit jiwa gwss elu mbak gws soalnya otak lo udah oglek banget ewhh jijik cara main nya begini alay betul
happy,"Terima kasih Dinporapar Kabupaten Purbalingga, juga rekan2 pramuwisata Purbalingga, yang telah datang dan berpartisipasi dalam acara buka puasa bersama. [USERNAME] untuk hadirnya pula. Sinergi saling mengisi dan memajukan Pariwisata. [URL]"
anger,"Ya gue tau sih, bukan grup kita yg digituin. Tapi sesama cewek, terus dibilang bahan gituan.... masih bisa terima? Dia jelas2 public figure, dan ngomong dengan enaknya di video bahan c**i? Gue ngetik aja ga nyaman. Wah gue lisa digituin aja gue semarah ini, gimana bangtan? -.-"
fear,Mesti nnton ne tengah malam nti dlm selimut . Habis nonton Eng ing eng.. Bunyi detak jarum jam dinding pun jd takut.. Terpaksa jam di cabut batre nya biar gk takut Wkwkwkwkwk Always~
sadness,kurang pengertian bisa mencintai bisa juga membenci namun tidak-pernah mau mengenal
happy,Dari tadi sore ngiler coto tapi gak sempat. Terus sampai rumah keburu capek. Lapar tengah malam buka kulkas nemu Indomie Coto Makassar. Alhamdullilah.. [URL]
sadness,"Mencoba bikin pudding Percobaan 1, salah bikin ternyata yg kubikin jadinya jelly nutrijell Percobaan 2, kubikin berlapis sama jelly ternyata rasanya plain Percobaan 3, bikin berlapis lagi ternyata nyampur karna belum keras. Apa salah dan dosaku sayang :("
sadness,"Nangis dipundak kamu, boleh? Aku pilu, sungguh."
anger,[USERNAME] siang min. Knpa saldo bonus tcash saya tidak ada. Padahal saya udah banyak dapat sms pemberitahuannya. Dan saya langsng aktivkan tcash walet. Mohn bntuanx. Trmaksih min
disgust,ya kalau pemikiran kaya gini kapan cancel culture jalan lagipula apa ga jijik nonton lonte di bioskop wkwkwk
happy,"Alhamdulillah di tempat kami tempat belanja lokal malah jauh lebih murah dan lengkap dari lapak sebelah, ga usah disuruh udah aja semua ke sana ? Usaha yang ihsan dan rapi harusnya milik punya org Islam. [URL]"
love,"Jika sayang orang tua, taati Allah, maka orang tua kita akan dihappyi Allah, disayang Allah, itulah sebenar-benar balasan kita pada orang tua #JumatBerkah"
anger,"Duh ini teman kantor udah minta tukar shift dadakan,nelpon udah jam 9 baru nelpon.gue jadi bak bik buk gak jelasss.!masihh ada aja temen yg tololnya di makan semua"
love,"aku sayang skz karena mereka super talented dan ternyata kagetnya masi seumuran sama aku, sangat memotivasi sih"
sadness,"Wah iya bgt ini mas, saya di tempat kerja sering bgt dpt hal ga ngenakin. Mereka (cowok2) nganggepnya becandaan, yg cewe2 nganggepnya saya yg salah knp begini knp begitu"
sadness,"Muridku dulu di sanggar tahfiz quran, masi keciiiil sekali, ngomong belum terang (belum jelas dia mau bilang apa), tapi waktu Aku simak surah-surah di juz 29, ehh lancarr kek air keran Malu sama diri sndiri"
sadness,"Wagelaseh, cuti ditolak. Di antara 135 org paling eug sendirian yg blm pernah balik ke rumah. ""Lu sih pong, ada libur panjang ga langsung kabur."""
happy,"Kayak tudey... abis dikabarin Ibu bakal telat transfernya krn ada satu dan lain hal.. tp di satu sisi saya lgi byk keperluan.. tp yaudah, sy cm bls ""gapapa bu santai aja"" Eh, mashaallah dah malem ini tbtb rezeki masuk ditransfer dosen :"")"
love,"Ketika permintaanmu bukan lagi sekedar meminta boneka baru, papa tahu ia tidak bisa memberikan apa yang kamu inginkan. Kata-kata yang keluar dari mulut papa adalah ""tidak... tidak bisa!"" Padahal dalam batin papa ia sangat ingin mengatakan ""iya sayang nanti papa belikan untukmu"""
fear,Di pesentren ini juga w dapat first experience dengan makhluk ghaib. Bentukannya masih orang tapi matanya naujubillah serem pengliatan langsung kuning. Kepala sakit berat. Ternyata w ketindisan. This is why im not interested in horror movie
disgust,darkor connect seru tapi bikin jijik
happy," Alhamdulillah semoga, ini momen yg sangat tepat bagi pak [USERNAME] [USERNAME] [USERNAME] [USERNAME] [USERNAME] [USERNAME] untuk dapat memberikan contoh kepada bangsa ini dan ummat Islam, bahwa menyambung menjalin menguatkan tali silaturahmi itu akan membawa keberkahan"
fear,"Itulah pentingnya materi kode etik diajarkan sejak SD, atau minimal ilmu ilmu dasar untuk berbuat baik, sopan, teratur. Lah kalo ga ya jadinya kaya gitu bablas, ga peka keadaan. gue lupa dulu BK, atau PKn atau SosUm bahas apaan, ya ada si kesananya tp ga khusus, jadi ga ngena"
disgust,kwkwkwkwkw asli disgusted af wek loba gaya padahal shitty personality ngebrag padahal coba tanya tuh ciwi ciwi gatau maen nya enak juga jijik banget dicatet kek sengaja
love,"Gue sama sekali gak tau awalnya kayak gimana. Yang jelas saat itu,makin lama gue makin sayang sama lu. Gue bilang,gue sayang lu itu sebagai temen deket. But,setelah dipikir pikir lagi,gue tuh sayang sama lu more than a friend."
anger,Dr minggu kmrn menyebalkan.. eh hri ini lagi ada tambahan.. janjian jam 10 eh lah kok malah jek antri nang BRI iki piye to..? Ku kesel deeh..
happy,mkasih aji selamat ulang tahun
happy,"Program anak paling digemari, ramah anak, recomended, layak tonton, Mimin bersyukur data menunjukkan 16-19% anak umur 5-14 tahun demen nonton ini... Itu artinya generasi muda masih ada harapan... Good job [USERNAME] [USERNAME] [USERNAME] [USERNAME] [URL]"
disgust,td di gue pas ada gambar cw sm cw dibilang jijik
disgust,dua hari yg lalu si sender nanya tentang jhope tp komenan dari el gk ngenakin bgt sampe ngatain jijik
fear,Serem banget sih yg jualan yg nipu-nipu. Gue bawa duit org dikit aja ga tenang banget ini kalo belum dapet kabar barangnya dapet kaga. Ini sampe orderan customer ga di beliin. :(
sadness,"Itu tersesat bgt. Yang seharusnya kamu belajar berbagai macam teori tentang sosial, di sini kamu dikasih berbagai macam angka dan rumus yg bikin gak nyaman, dan jatuhnya malah jadi orang paling tertinggal di kelas."
sadness,"Salah sangka yang menghasilkan sebuah kekecawaan. Kekecewaan yang pada dasarnya tak mempunyai alasan yang kuat. Namun, saat semua situasi sudah kembali clear. Itu menjadi sesuatu yang lucu untuk diingat."
disgust,bengkak banget anjing kagak gw pap karena jijik liatnya
anger,ga pernah bikin status galau di ig.. sekalinya bikin banyak yg kepoooo... pd sotoyyy.. lgsg jadiin bahan gosip.. sok pangnyaho na weh.. sebel efeklgdatengtamu
sadness,"Apakah benar kita lebih pantas dibanding mereka yang mendapatkannya? Kita gak tau, kita hanya melihat perjuangan kita tanpa melihat perjuangan mereka yang tidak terlihat oleh kita. Sederhananya, masing-masing sudah diberikan tempat oleh Tuhan dan tidak akan tertukar."
fear,benar sekali terutama menyebrang di Jalan Margonda. Dari kelapa dua - pertigaan Juanda mungkin hanya ada 3-5 zebra cross. Motor-mobil semuanya ngebut sehingga jadi takut kalau nyebrang. Sekalinya nyebrang malah jadi khawatir kendaraan ngerem mendadak
happy,"Beliau disana, mendengarkan sembari tersenyum. Sesekali cerita kami terpotong oleh orang-orang yang keluar masuk meminta tanda tangannya. Sampai kemudian berujung pada satu inti, 'Boleh tidak pak, kita berdua ujian duluan?' Dan beliau tertawa, tapi masih berwibawa dan teduh."
anger,"Otak kalo sudah bego mau apapun posisinya,apapun gelarnya tetap saja bego. Hrsnya otak diisi ilmu pengetahuan bukan diisi maaf..tai. [URL]"
fear,"Coba cari terus siapa tahu ada yang kecebur jatuh , atau terperangkap didalam gua , karena guanya gelap & banjir jd licin bs ajach kepleset"
sadness,"Aku cuma bisa ngucapin terima kasih kepada mantan yang telah memberi pelajaran bahwa cinta tak semanis yang dibayangkan, membuatku bahagia, dan mengajarkan aku banyak hal."
anger,[USERNAME] Jasa pengiriman sangat tidak profesional!! Sampe kapanpun gak akan pake jasa pengiriman ini lagi.... menanggapi pengaduan lama! Awas aja paket sy yg nyasar krn petugas anda salah input sampe ilang berarti su Viralkan!
love,"Mamah adalah sumber kasih sayang, mengasuh dan memberi tanpa batas. Mamahlah yang selalu berjaga dan terjaga dikala malam hari. Yg selalu menemani, mengajarkan berjuang"
disgust,awalnya jijik dgn adegan di film itu kini tak lagi peduli karna nafsuku sudah sangat memuncak aku menjilati vagina mertuaku itu seperti apa yg dia lakukan kepadaku setalah puas kami pun melakukan adegan seperti layaknya dua gunting yg saling mengadu dimana vaginaku dan
sadness,"dear pak [USERNAME], pak ini beneran ta ndak ada libur setelah hari raya pak:( masa tanggal merah sehari aja pakk, baru pulang sholat-takbiran masa langsung merantau lagi pak:( [URL]"
anger,[USERNAME] [USERNAME] Waketum Gerindrong Dongo Instagram menghapus secara sepihak karena kalian telah melanggar hukum ( Foto2 didepan Kabah itu melanggar hukum ) [URL]
sadness,"[USERNAME] [USERNAME] Jadi mayoritas pun juga hasil paksaan , bukan atas keinginan sendiri. Memang benar banyak yang dipaksa agar terlihat mayoritas. Jika tak mau jadi mayoritas, maka bakal dipersulit [URL]"
sadness,"Ya begini deh nganggur di tempat kerja karena udah selesai. Berakhir dengan *cuat - cuit* di twitter Mau ghibah sama mbak - mbak, sungkan lagi puasa. Ehe *tiga jam kemudian dia pasti ngajakin ngomongin orang kok* *kebiasaan* *banyak istighfar*"
love,"[USERNAME] ""Yaudah kita ke apartemen sekarang ya sayang"" ucapnya sambil tersenyum. Amber pun berjalan sambil menggenggam tangan kekasihnya ke lobby. ""Kamu tunggu disini ya sayang, aku ambil mobil dulu"" ucapnya sambil melepas genggaman tangan kekasihnya. "
disgust,misinya membuat vidio spt ini adalah agar jamaah jumat jadi sepi krn membuat fikiran takut jijik banyak lelaki model beginian ikut jumatan
